,title,year,synopsis,critic_score,people_score,consensus,total_reviews,total_ratings,type,rating,genre,original_language,director,producer,writer,release_date_(theaters),release_date_(streaming),box_office_(gross_usa),runtime,production_co,sound_mix,aspect_ratio,view_the_collection,crew,link
120,Shaun the Sheep Movie,2015,"All is well at Mossy Bottom Farm, except for the fact that the animals will do anything to get out of work. So, Shaun the sheep and his scheming friends devise a plan to put their master to sleep. However, the ruse backfires when the poor farmer finds himself transported to the big city, having lost his memory. Now, it's up to Sean, Timmy the lamb, Shirley the ewe and the rest of the gang to travel to the metropolis and get him back, while not landing in even more trouble themselves.",99,81,"Warm, funny, and brilliantly animated, Shaun the Sheep is yet another stop-motion jewel in Aardman's family-friendly crown.",170,"10,000+",Animation,PG (Rude Humor),"kids and family, comedy, adventure, animation",English,"Mark Burton, Richard Starzak","Julie Lockhart, Paul Kewley","Mark Burton, Richard Starzak","Aug 5, 2015 wide","Jun 1, 2016",$19.4M,1h 25m,"Aardman Animations, Anton Capital Entertainment, Studio Canal",,,,"Justin Fletcher, John Sparkes, Omid Djalili, Richard Webber, Kate Harbour, Tim Hands, Andy Nyman, Simon Greenall, Emma Tate, Jack Paulson, Mark Burton, Richard Starzak, Mark Burton, Richard Starzak, Julie Lockhart, Paul Kewley, Peter Lord, Nick Park, David Sproxton, Olivier Courson",http://www.rottentomatoes.com/m/shaun_the_sheep_movie
121,WALL-E,2008,"WALL-E, short for Waste Allocation Load Lifter Earth-class, is the last robot left on Earth. He spends his days tidying up the planet, one piece of garbage at a time. But during 700 years, WALL-E has developed a personality, and he's more than a little lonely. Then he spots EVE (Elissa Knight), a sleek and shapely probe sent back to Earth on a scanning mission. Smitten WALL-E embarks on his greatest adventure yet when he follows EVE across the galaxy.",95,90,"Wall-E's stellar visuals testify once again to Pixar's ingenuity, while its charming star will captivate younger viewers -- and its timely story offers thought-provoking subtext.",260,"250,000+",Animation,G,"sci fi, comedy, adventure, animation, kids and family",English,Andrew Stanton,Jim Morris,"Andrew Stanton, Jim Reardon","Jun 27, 2008 wide","Nov 22, 2015",,1h 37m,Pixar Animation Studios,"SDDS, Dolby Digital, DTS",,Pixar,"Ben Burtt, Elissa Knight, Jeff Garlin, Fred Willard, John Ratzenberger, Kathy Najimy, Sigourney Weaver, Bob Bergen, Andrew Stanton, Andrew Stanton, Jim Reardon, Jim Morris, Thomas Newman, Thomas Newman, John Lasseter, Ralph Eggleston, Jeremy Lasky",http://www.rottentomatoes.com/m/wall_e
122,Dumbo,1941,"A young circus elephant is born with comically large ears and given the cruel nickname Dumbo. One day at a show, he is taunted by a group of kids, inciting his mother into a rage that gets her locked up. After Dumbo's ears cause an accident that injures many of the other elephants, he is made to dress like a clown and perform dangerous stunts. Everything changes when Dumbo discovers that his enormous ears actually allow him to fly, and he astounds everyone at the circus with his new talent.",98,70,"Dumbo packs plenty of story into its brief runtime, along with all the warm animation and wonderful music you'd expect from a Disney classic.",43,"250,000+",Animation,G,"kids and family, animation, fantasy",English,Ben Sharpsteen,Walt Disney,"Joe Grant, Dick Huemer",,"Dec 13, 2015",,1h 4m,Walt Disney Productions,Stereo,,,"Herman Bing, Billy Bletcher, Edward Brophy, Cliff Edwards, Verna Felton, Noreen Gammill, Sterling Holloway, Malcolm Hutton, John McLeish, Ben Sharpsteen, Joe Grant, Dick Huemer, Walt Disney",http://www.rottentomatoes.com/m/dumbo
123,Ratatouille,2007,"Remy (Patton Oswalt), a resident of Paris, appreciates good food and has quite a sophisticated palate. He would love to become a chef so he can create and enjoy culinary masterpieces to his heart's delight. The only problem is, Remy is a rat. When he winds up in the sewer beneath one of Paris' finest restaurants, the rodent gourmet finds himself ideally placed to realize his dream.",96,87,"Fast-paced and stunningly animated, Ratatouille adds another delightfully entertaining entry -- and a rather unlikely hero -- to the Pixar canon.",251,"250,000+",Animation,G,"animation, comedy, kids and family",English,Brad Bird,Brad Lewis,Brad Bird,"Jun 29, 2007 wide","Nov 23, 2015",$206.4M,1h 51m,Pixar Animation Studios,"Dolby SRD, DTS, SDDS",Scope (2.35:1),Pixar,"Patton Oswalt, Ian Holm, Lou Romano, Brian Dennehy, Peter Sohn, Peter O'Toole, Brad Garrett, Janeane Garofalo, Will Arnett, Julius Callahan, Brad Bird, Jan Pinkava, Brad Bird, John Lasseter, Andrew Stanton, Brad Lewis, Michael Giacchino, Sharon Calahan, Darren Holmes",http://www.rottentomatoes.com/m/ratatouille
124,My Life as a Zucchini,2016,A police officer (Nick Offerman) and some new friends help an orphan adjust to life at a foster home.,99,89,My Life as a Zucchini's silly title and adorable characters belie a sober story whose colorful visuals delight the senses even as it braves dark emotional depths.,137,"5,000+",Animation,PG-13 (Thematic Elements|Suggestive Material),"comedy, drama, animation",French (France),Claude Barras,"Marc Bonny, Armelle Glorennec, Pauline Gygax, Max Karli",Céline Sciamma,"Feb 24, 2017 limited","May 11, 2017",$292.3K,1h 6m,"Rita Productions, KNM, Blue Spirit Animation",,,,"Will Forte, Nick Offerman, Ellen Page, Amy Sedaris, Clara Young, Erick Abbate, Ness Krell, Romy Beckman, Barry Mitchell, Finn Robbins, Claude Barras, Céline Sciamma, Marc Bonny, Armelle Glorennec, Pauline Gygax, Max Karli, Valentin Rotelli",http://www.rottentomatoes.com/m/my_life_as_a_zucchini
125,The Incredibles,2004,"In this lauded Pixar animated film, married superheroes Mr. Incredible (Craig T. Nelson) and Elastigirl (Holly Hunter) are forced to assume mundane lives as Bob and Helen Parr after all super-powered activities have been banned by the government. While Mr. Incredible loves his wife and kids, he longs to return to a life of adventure, and he gets a chance when summoned to an island to battle an out-of-control robot. Soon, Mr. Incredible is in trouble, and it's up to his family to save him.",97,75,"Bringing loads of wit and tons of fun to the animated superhero genre, The Incredibles easily lives up to its name.",248,"250,000+",Animation,PG (Action/Violence),"kids and family, comedy, adventure, animation",English,Brad Bird,"John Lasseter, John Walker",Brad Bird,"Nov 5, 2004 wide","Nov 23, 2015",$261.4M,1h 55m,Pixar Animation Studios,"Surround, Dolby SRD, DTS, SDDS",Scope (2.35:1),Pixar,"Craig T. Nelson, Holly Hunter, Samuel L. Jackson, Jason Lee, Wallace Shawn, Sarah Vowell, Brad Bird, Elizabeth Peña, Dominique Louis, Brad Bird, Brad Bird, John Lasseter, Stephen Schaffer, Michael Giacchino, Lou Romano",http://www.rottentomatoes.com/m/incredibles
126,Only Yesterday,1991,A put-upon 27-year-old Japanese office worker travels to the countryside and reminisces about her childhood in Tokyo and what life could have been.,100,85,Only Yesterday's long-delayed U.S. debut fills a frustrating gap for American Ghibli fans while offering further proof of the studio's incredibly consistent commitment to quality.,56,100+,Animation,,"drama, anime",Japanese,Isao Takahata,Yasuyoshi Tokuma,"Isao Takahata, David Freedman","Jan 1, 2016 limited","Dec 17, 2019",,1h 58m,,,,,"Daisy Ridley, Dev Patel, Ashley Eckstein, Alison Fernandez, Isao Takahata, Isao Takahata, David Freedman, Yasuyoshi Tokuma, Hayao Miyazaki, Katsu Hoshi",http://www.rottentomatoes.com/m/only_yesterday_1991
127,The LEGO Batman Movie,2017,"There are big changes brewing in Gotham, but if Batman (Will Arnett) wants to save the city from the Joker's (Zach Galifianakis) hostile takeover, he may have to drop the lone vigilante thing, try to work with others and maybe, just maybe, learn to lighten up. Maybe his superhero sidekick Robin (Michael Cera) and loyal butler Alfred (Ralph Fiennes) can show him a thing or two.",90,80,The Lego Batman Movie continues its block-buster franchise's winning streak with another round of dizzyingly funny -- and beautifully animated -- family-friendly mayhem.,314,"25,000+",Animation,PG (Rude Humor and Some Action),"comedy, animation, action, kids and family, adventure",English,Chris McKay,"Dan Lin, Phil Lord, Christopher Miller, Roy Lee","Seth Grahame-Smith, Chris McKenna, Erik Sommers, Jared Stern, John Whittington","Feb 10, 2017 wide","May 19, 2017",$175.7M,1h 46m,"Warner Bros. Pictures, Lin Pictures, Vertigo Entertainment","Dolby Atmos, Dolby Digital, SDDS, Datasat",Scope (2.35:1),Batman,"Will Arnett, Michael Cera, Rosario Dawson, Ralph Fiennes, Zach Galifianakis, Jenny Slate, Jason Mantzoukas, Conan O'Brien, Doug Benson, Chris McKay, Seth Grahame-Smith, Chris McKenna, Erik Sommers, Jared Stern, John Whittington, Dan Lin, Phil Lord, Christopher Miller, Roy Lee",http://www.rottentomatoes.com/m/the_lego_batman_movie
128,One Hundred and One Dalmatians,1961,"In a Disney animation classic, Dalmatian Pongo is tired of his bachelor-dog life. He spies lovely Perdita and maneuvers his master, Roger, into meeting Perdita's owner, Anita. The owners fall in love and marry, keeping Pongo and Perdita together too. After Perdita gives birth to a litter of 15 puppies, Anita's old school friend Cruella De Vil wants to buy them all. Roger declines her offer, so Cruella hires the criminal Badun brothers to steal them -- so she can have a fur coat.",98,76,"With plenty of pooches and a memorable villain (Cruella De Vil), this is one of Disney's most enduring, entertaining animated films.",51,"250,000+",Animation,G,"kids and family, comedy, adventure, animation",English,"Wolfgang Reitherman, Hamilton S. Luske, Clyde Geronimi",Walt Disney,,,"Aug 10, 2016",$91.3M,1h 19m,Walt Disney Productions,Surround,,,"Rod Taylor, Betty Lou Gerson, Cate Bauer, Lisa Daniels, Ben Wright, Frederick Worlock, Martha Wentworth, J. Pat O'Malley, Tudor Owen, Wolfgang Reitherman, Hamilton S. Luske, Clyde Geronimi, Dodie Smith, Walt Disney, Donald Halliday, Ken Anderson",http://www.rottentomatoes.com/m/101_dalmatians
129,Beauty and the Beast,1991,"An arrogant young prince (Robby Benson) and his castle's servants fall under the spell of a wicked enchantress, who turns him into the hideous Beast until he learns to love and be loved in return. The spirited, headstrong village girl Belle (Paige O'Hara) enters the Beast's castle after he imprisons her father Maurice (Rex Everhart). With the help of his enchanted servants, including the matronly Mrs. Potts (Angela Lansbury), Belle begins to draw the cold-hearted Beast out of his isolation.",94,92,"Enchanting, sweepingly romantic, and featuring plenty of wonderful musical numbers, Beauty and the Beast is one of Disney's most elegant animated offerings.",118,"250,000+",Animation,G,"kids and family, animation, fantasy",English,"Gary Trousdale, Kirk Wise",Don Hahn,Linda Woolverton,,"Sep 6, 2016",$219.0M,1h 24m,Walt Disney Pictures,Surround,,,"Paige O'Hara, Robby Benson, Jerry Orbach, David Ogden Stiers, Angela Lansbury, Bradley Pierce, Rex Everhart, Jesse Corti, Hal Smith, Gary Trousdale, Kirk Wise, Howard Ashman, Don Hahn, Alan Menken, John Carnochan, Brian McEntee, Linda Woolverton",http://www.rottentomatoes.com/m/beauty_and_the_beast_1991
130,Chicken Run,2000,"This engaging stop-motion, claymation adventure tells the story of an American rooster who falls in love with a gorgeous hen on a British farm. The couple decides to run away from the farm, but they must first contend with the evil farmer who is intent on keeping them under her control. The chickens decide to attempt an escape so they don't get turned into chicken pot pies.",97,65,"Chicken Run has all the charm of Nick Park's Wallace & Gromit, and something for everybody. The voice acting is fabulous, the slapstick is brilliant, and the action sequences are spectacular.",172,"250,000+",Animation,G,"kids and family, comedy, adventure, animation",English,"Peter Lord, Nick Park",,Karey Kirkpatrick,"Jun 21, 2000 wide","Nov 25, 2015",,1h 25m,"Allied Filmmakers, DreamWorks Pictures, Aardman Animations, Pathé Pictures","Dolby EX, SDDS, DTS, Surround",Flat (1.85:1),,"Mel Gibson, Julia Sawalha, Miranda Richardson, Jane Horrocks, Lynn Ferguson, Imelda Staunton, Benjamin Whitrow, Tony Haygarth, Timothy Spall, Phil Daniels, Peter Lord, Nick Park, Karey Kirkpatrick, Jake Eberts, Jeffrey Katzenberg, Harry Gregson-Williams, Dave Alex Riddett, Tristan Oliver",http://www.rottentomatoes.com/m/chicken_run
131,Onward,2020,"Teenage elf brothers Ian and Barley embark on a magical quest to spend one more day with their late father. Like any good adventure, their journey is filled with cryptic maps, impossible obstacles and unimaginable discoveries. But when dear Mom finds out her sons are missing, she teams up with the legendary manticore to bring her beloved boys back home.",88,95,"It may suffer in comparison to Pixar's classics, but Onward makes effective use of the studio's formula -- and stands on its own merits as a funny, heartwarming, dazzlingly animated adventure.",333,"5,000+ Verified",Animation,PG (Some Mild Thematic Elements|Action/Peril),"adventure, animation, fantasy, comedy, kids and family",English,Dan Scanlon,Kori Rae,"Dan Scanlon, Jason Headley, Keith Bunin","Mar 6, 2020 wide","Mar 6, 2020",$60.4M,1h 43m,"Pixar Animation Studios, Walt Disney Pictures","Dolby Atmos, DTS",Scope (2.35:1),Pixar,"Tom Holland, Chris Pratt, Julia Louis-Dreyfus, Octavia Spencer, Ali Wong, John Ratzenberger, Lena Waithe, Mel Rodriguez, Grey Griffin, Tracey Ullman, Dan Scanlon, Dan Scanlon, Jason Headley, Keith Bunin, Kori Rae, Pete Docter, Sharon Calahan, Catherine Apple",http://www.rottentomatoes.com/m/onward
132,The Nightmare Before Christmas,1993,"The film follows the misadventures of Jack Skellington, Halloweentown's beloved pumpkin king, who has become bored with the same annual routine of frightening people in the ""real world."" When Jack accidentally stumbles on Christmastown, all bright colors and warm spirits, he gets a new lease on life -- he plots to bring Christmas under his control by kidnapping Santa Claus and taking over the role. But Jack soon discovers even the best-laid plans of mice and skeleton men can go seriously awry.",95,91,The Nightmare Before Christmas is a stunningly original and visually delightful work of stop-motion animation.,96,"250,000+",Animation,PG (Some Scary Images),"comedy, fantasy, animation, other, kids and family",English,Henry Selick,"Tim Burton, Denise Di Novi, Kathleen Gavin",Caroline Thompson,"Oct 29, 1993 wide","Nov 24, 2015",$2.4M,1h 15m,"Touchstone Pictures, Skellington Productions","Surround, Dolby SR, Dolby Digital, Dolby Stereo",Flat (1.85:1),,"Danny Elfman, Chris Sarandon, Catherine O'Hara, William Hickey, Glenn Shadix, Paul Reubens, Ed Ivory, Henry Selick, Michael McDowell, Caroline Thompson, Tim Burton, Denise Di Novi, Danny Elfman, Kathleen Gavin, Jill Jacobs, Diane Minter Lewis",http://www.rottentomatoes.com/m/nightmare_before_christmas
133,Anomalisa,2015,An inspirational speaker (David Thewlis) becomes reinvigorated after meeting a lively woman (Jennifer Jason Leigh) who shakes up his mundane existence.,92,71,"Anomalisa marks another brilliant and utterly distinctive highlight in Charlie Kaufman's filmography, and a thought-provoking treat for fans of introspective cinema.",275,"10,000+",Animation,R (Language|Graphic Nudity|Strong Sexual Content),"comedy, drama, animation",English,"Charlie Kaufman, Duke Johnson","Rosa Tran, Duke Johnson, Charlie Kaufman, Dino Stamatopoulos",Charlie Kaufman,"Mar 18, 2016 wide","Dec 19, 2016",$3.4M,1h 30m,"Starburns Industries, Snoot Entertainment",,,,"Jennifer Jason Leigh, David Thewlis, Charlie Kaufman, Duke Johnson, Charlie Kaufman, Rosa Tran, Duke Johnson, Charlie Kaufman, Dino Stamatopoulos, Joe Passarelli, Garret Elkins, Carter Burwell",http://www.rottentomatoes.com/m/anomalisa
134,"Monsters, Inc.",2001,"Monsters Incorporated is the largest scare factory in the monster world, and James P. Sullivan (John Goodman) is one of its top scarers. Sullivan is a huge, intimidating monster with blue fur, large purple spots and horns. His scare assistant, best friend and roommate is Mike Wazowski (Billy Crystal), a green, opinionated, feisty little one-eyed monster. Visiting from the human world is Boo (Mary Gibbs), a tiny girl who goes where no human has ever gone before.",96,90,"Clever, funny, and delightful to look at, Monsters, Inc. delivers another resounding example of how Pixar elevated the bar for modern all-ages animation.",197,"250,000+",Animation,G,"comedy, fantasy, animation, kids and family, adventure",English,Pete Docter,Darla K. Anderson,,"Nov 2, 2001 wide","Oct 20, 2013",$494.0K,1h 32m,"Walt Disney Productions, Pixar Animation Studios","Dolby SR, DTS, Dolby Stereo, Surround, SDDS, Dolby A, Dolby Digital",Scope (2.35:1),Pixar,"John Goodman, Billy Crystal, Mary Gibbs, Steve Buscemi, James Coburn, Jennifer Tilly, Bob Peterson, John Ratzenberger, Frank Oz, Steve Susskind, Pete Docter, David Silverman, Lee Unkrich, Darla K. Anderson, John Lasseter, Andrew Stanton, Kori Rae, Pete Docter, Jill Culton, Jeff Pidgeon",http://www.rottentomatoes.com/m/monsters_inc
135,Grave of the Fireflies,1988,A teenager (J. Robert Spencer) is charged with the care of his younger sister (Rhoda Chrosite) after an Allied firebombing during World War II destroys their home and kills their mother.,100,95,"An achingly sad anti-war film, Grave of the Fireflies is one of Studio Ghibli's most profoundly beautiful, haunting works.",40,"50,000+",Animation,,"drama, war, anime",Japanese,Isao Takahata,Toru Hara,Isao Takahata,,"Mar 11, 2017",,1h 28m,,,,,"J. Robert Spencer, Rhoda Chrosite, Amy Jones, Veronica Taylor, Isao Takahata, Isao Takahata, Toru Hara, Ryôichi Satô, Nobuo Koyama, Takeshi Seyama, Ryôichi Satô, Nizou Yamamoto",http://www.rottentomatoes.com/m/grave_of_the_fireflies
136,Fantasia,1940,"Released in 1940, represented Disney's boldest experiment to date. Bringing to life his vision of blending animated imagery with classical music. What had begun as a vehicle to enhance Mickey Mouse's career blossomed into a full-blown feature that remains unique in the history of animation.",95,83,"A landmark in animation (and a huge influence on the medium of music video), Disney's Fantasia is a relentlessly inventive blend of the classics with phantasmagorical images.",56,"100,000+",Animation,G,"kids and family, animation, fantasy",English,"James Algar, Samuel Armstrong, Ford Beebe, Norman Ferguson, Jim Handley, T. Hee, Wilfred Jackson, Hamilton Luske, Bill Roberts, Paul Satterfield",,,,"May 5, 2017",$24.8M,2h,Walt Disney Productions,"Surround, Magnetic Stereo 6 Track, Fantasound, Dolby Stereo, Mono",Academy (1.33:1),,"Deems Taylor, Leopold Stokowski, Walt Disney, Julietta Novis, The Philadelphia Orchestra, Paul J. Smith, James Algar, Samuel Armstrong, Ford Beebe, Norman Ferguson, Jim Handley, T. Hee, Wilfred Jackson, Hamilton Luske, Paul Satterfield",http://www.rottentomatoes.com/m/fantasia
137,Your Name,2016,A teenage boy and girl embark on a quest to meet each other for the first time after they magically swap bodies.,98,94,"As beautifully animated as it is emotionally satisfying, Your Name adds another outstanding chapter to writer-director Makoto Shinkai's filmography.",117,"10,000+",Animation,PG (Smoking|Brief Language|Suggestive Content|Thematic Elements),"romance, fantasy, anime",Japanese,Makoto Shinkai,"Noritaka Kawaguchi, Genki Kawamura",Makoto Shinkai,"Apr 7, 2017 limited","Jan 31, 2018",,1h 46m,Toho Company Ltd.,Dolby Digital,,,"Michael Sinterniklaas, Stephanie Sheh, Laura Post, Kyle Hebert, Cassandra Morris, Ben Pronsky, Ray Chase, Catie Harvey, Makoto Shinkai, Makoto Shinkai, Noritaka Kawaguchi, Genki Kawamura",http://www.rottentomatoes.com/m/your_name_2017
138,Spirited Away,2001,"10-year-old Chihiro (Daveigh Chase) moves with her parents to a new home in the Japanese countryside. After taking a wrong turn down a wooded path, Chihiro and her parents discover an amusement park with a stall containing an assortment of food. To her surprise, Chihiro's parents begin eating and then transform into pigs. In this supernatural realm, Chihiro encounters a host of characters and endures labor in a bathhouse for spirits, awaiting a reunion with her parents.",97,96,"Spirited Away is a dazzling, enchanting, and gorgeously drawn fairy tale that will leave viewers a little more curious and fascinated by the world around them.",189,"250,000+",Animation,PG (Some Scary Moments),"animation, adventure, fantasy",Japanese,"Hayao Miyazaki, Kirk Wise","Donald W. Ernst, Toshio Suzuki",Hayao Miyazaki,"Sep 20, 2002 wide","Dec 19, 2019",$10.0M,2h 5m,"Walt Disney Pictures, Tokuma Shoten, Studio Ghibli","Dolby SR, DTS, Dolby Stereo, Surround, Dolby A, Dolby Digital",Flat (1.85:1),,"Daveigh Chase, Suzanne Pleshette, Jason Marsden, David Ogden Stiers, Lauren Holly, Michael Chiklis, John Ratzenberger, Tara Strong, Hayao Miyazaki, Hayao Miyazaki, Kirk Wise, Donald W. Ernst, Toshio Suzuki, John Lasseter, Lori Korngiebel, Yoji Takeshige, Noboru Yoshida",http://www.rottentomatoes.com/m/spirited_away
139,The Iron Giant,1999,"In this animated adaptation of Ted Hughes' Cold War fable, a giant alien robot (Vin Diesel) crash-lands near the small town of Rockwell, Maine, in 1957. Exploring the area, a local 9-year-old boy, Hogarth, discovers the robot, and soon forms an unlikely friendship with him. When a paranoid government agent, Kent Mansley, becomes determined to destroy the robot, Hogarth and beatnik Dean McCoppin (Harry Connick Jr.) must do what they can to save the misunderstood machine.",96,90,The endearing Iron Giant tackles ambitious topics and complex human relationships with a steady hand and beautifully animated direction from Brad Bird.,143,"100,000+",Animation,PG (Mild Language|Fantasy Action),"kids and family, animation, adventure, fantasy",English,Brad Bird,"Des McAnuff, Allison Abbate","Brad Bird, Tim McCanlies","Aug 4, 1999 wide","Apr 3, 2008",,1h 26m,Warner Brothers,Surround,,,"Jennifer Aniston, Eli Marienthal, Harry Connick Jr., Vin Diesel, Christopher McDonald, James Gammon, Cloris Leachman, John Mahoney, M. Emmet Walsh, Brad Bird, Brad Bird, Tim McCanlies, Pete Townshend, Des McAnuff, Allison Abbate, Michael Kamen, Darren T. Holmes",http://www.rottentomatoes.com/m/iron_giant
140,Song of the Sea,2014,An Irish youth (David Rawle) discovers that his mute sister is a selkie who must find her voice and free supernatural creatures from the spell of a Celtic goddess (Fionnula Flanagan).,99,92,"Song of the Sea boasts narrative depth commensurate with its visual beauty, adding up to an animated saga overflowing with family-friendly riches.",97,"10,000+",Animation,PG (Pipe Smoking Images|Language|Some Mild Peril),"animation, adventure, fantasy",English,Tomm Moore,"Tomm Moore, Ross Murray, Paul Young, Stéphan Roelants, Serge Ume, Isabelle Truc, Clément Calvet, Jeremie Fajner",Will Collins,,"Mar 16, 2015",$850.0K,1h 34m,"Cartoon Saloon, Irish Film Board",,,,"Brendan Gleeson, Fionnula Flanagan, David Rawle, Pat Shortt, Jon Kenny, Lucy O'Connell, Colm Ó'Snodaigh, Tomm Moore, Will Collins, Tomm Moore, Paul Young, Stéphan Roelants, Serge Ume, Isabelle Truc, Clément Calvet, Jeremie Fajner",http://www.rottentomatoes.com/m/song_of_the_sea_2014
141,Tower,2016,"On Aug. 1, 1966, a sniper rode the elevator to the top floor of the University of Texas Tower and opened fire, holding the campus hostage for 96 minutes. When the gunshots were finally silenced, the toll included 16 dead, three dozen wounded, and a shaken nation left trying to understand what had happened. Archival footage is combined with rotoscopic animation in a dynamic, never-before-seen way to illustrate the action-packed untold stories of the witnesses, heroes and survivors.",99,89,Tower probes into a painful chapter of American history with sensitivity and grace -- and revisits its events from a valuable new perspective.,99,"2,500+",Animation,,documentary,English,Keith Maitland,"Megan Gilbride, Susan Thomson",,"Oct 12, 2016 limited","Jan 11, 2017",$84.3K,1h 38m,"Go-Valley , Texas Archive of the Moving Image, Killer Impact",,,,"Violett Beane, Blair Jackson, Josephine McAdam, Reece Everett Ryan, Chris Doubek, Louie Arnette, Keith Maitland, Megan Gilbride, Pamela Colloff",http://www.rottentomatoes.com/m/tower_2016
142,The Lion King,1994,"This Disney animated feature follows the adventures of the young lion Simba (Jonathan Taylor Thomas), the heir of his father, Mufasa (James Earl Jones). Simba's wicked uncle, Scar (Jeremy Irons), plots to usurp Mufasa's throne by luring father and son into a stampede of wildebeests. But Simba escapes, and only Mufasa is killed. Simba returns as an adult (Matthew Broderick) to take back his homeland from Scar with the help of his friends Timon (Nathan Lane) and Pumbaa (Ernie Sabella).",93,93,"Emotionally stirring, richly drawn, and beautifully animated, The Lion King is a pride within Disney's pantheon of classic family films.",130,"250,000+",Animation,G,"kids and family, animation, adventure, musical",English,"Roger Allers, Rob Minkoff",Don Hahn,"Irene Mecchi, Jonathan Roberts, Linda Woolverton","Jun 24, 1994 wide","Aug 15, 2017",$422.8M,1h 27m,Walt Disney Pictures,"Dolby SR, DTS, Dolby Stereo, SDDS, DTS-ES, Dolby A, Surround, Dolby Digital",Flat (1.85:1),,"Matthew Broderick, Jeremy Irons, James Earl Jones, Madge Sinclair, Moira Kelly, Nathan Lane, Rowan Atkinson, Ernie Sabella, Niketa Calame, Jonathan Taylor Thomas, Roger Allers, Rob Minkoff, Don Hahn, Irene Mecchi, Jonathan Roberts, Linda Woolverton, Elton John",http://www.rottentomatoes.com/m/the_lion_king
