,title,year,synopsis,critic_score,people_score,consensus,total_reviews,total_ratings,type,rating,genre,original_language,director,producer,writer,release_date_(theaters),release_date_(streaming),box_office_(gross_usa),runtime,production_co,sound_mix,aspect_ratio,view_the_collection,crew,link
258,Toni Erdmann,2016,A film by Maren Ade.,93,73,"Toni Erdmann pairs carefully constructed, three-dimensional characters in a tenderly funny character study that's both genuinely moving and impressively ambitious.",239,"5,000+",Art House & International,R (Graphic Nudity|Brief Drug Use|Language|Strong Sexual Content),"comedy, drama",German,Maren Ade,"Janine Jackowski, Maren Ade, Jonas Dornbach",Maren Ade,"Dec 25, 2016 limited","Apr 11, 2017",$1.5M,2h 42m,"Missing Link Films, Coop99, KNM, Komplizen Film",,,,"Peter Simonischek, Michael Wittenborn, Thomas Loibl, Trystan Pütter, Hadewych Minis, Lucy Russell, Ingrid Bisu, Vlad Ivanov, Victoria Cocias, Maren Ade, Maren Ade, Janine Jackowski, Maren Ade, Jonas Dornbach, Ben von Dobeneck, Patrick Orth, Heike Parplies, Silke Fischer",http://www.rottentomatoes.com/m/toni_erdmann
259,The Young Girls of Rochefort,1967,"Delphine (Catherine Deneuve) and Solange (Françoise Dorléac) are twin sisters who each want to find romance and leave their small seaside town of Rochefort, France. Soon they befriend a couple of visiting carnival workers who frequent their lonely mother's (Danielle Darrieux) café and hire the girls to sing in the carnival. Wanting a career as a songwriter, Solange falls for an American musician, Andy (Gene Kelly), while Delphine dumps her beau and searches Rochefort for her ideal man.",98,84,The Young Girls of Rochefort pays colorful homage to classic Hollywood musicals while earning its own emotionally affecting place of honor in the genre.,44,"2,500+",Art House & International,G,"romance, musical",French (France),"Jacques Demy, Agnès Varda","Perrine Bauduin, Gilbert De Goldschmidt","Jacques Demy, Julian More",,"Apr 11, 2017",$88.5K,2h 5m,Miramax,Stereo,"35mm, Scope (2.35:1)",,"Catherine Deneuve, Françoise Dorléac, Gene Kelly, George Chakiris, Grover Dale, Jacques Perrin, Danielle Darrieux, Geneviève Thenier, Pamela Hart, Leslie North, Jacques Demy, Agnès Varda, Jacques Demy, Julian More, Perrine Bauduin, Gilbert De Goldschmidt, Michel Legrand, Ghislain Cloquet, Jean Hamon, Bernard Evein",http://www.rottentomatoes.com/m/the_young_girls_of_rochefort
260,Timbuktu,2014,A Malian cattleman (Ibrahim Ahmed) and his family face the wrath of Islamic fundamentalists after a tragic accident.,98,77,"Gracefully assembled and ultimately disquieting, Timbuktu is a timely film with a powerful message.",123,"5,000+",Art House & International,PG-13 (Thematic Elements|Some Violence),drama,French (France),Abderrahmane Sissako,"Rémi Burah, Etienne Comar, Sylvie Pialat, Olivier Père","Abderrahmane Sissako, Kessen Tall",,"May 26, 2015",$1.1M,1h 37m,Les Films du Worso,,,,"Ibrahim Ahmed, Toulou Kiki, Abel Jafri, Fatoumata Diawara, Hichem Yacoubi, Kettly Noël, Layla Walet Mohamed, Adel Mahmoud Cherif, Salem Dendou, Abderrahmane Sissako, Abderrahmane Sissako, Kessen Tall, Rémi Burah, Etienne Comar, Sylvie Pialat, Nadia Ben Rachid",http://www.rottentomatoes.com/m/timbuktu_2015
261,"Crouching Tiger, Hidden Dragon",2000,"In 19th century Qing Dynasty China, a warrior (Chow Yun-Fat) gives his sword, Green Destiny, to his lover (Michelle Yeoh) to deliver to safe keeping, but it is stolen, and the chase is on to find it. The search leads to the House of Yu where the story takes on a whole different level.",97,86,"The movie that catapulted Ang Lee into the ranks of upper echelon Hollywood filmmakers, Crouching Tiger, Hidden Dragon features a deft mix of amazing martial arts battles, beautiful scenery, and tasteful drama.",158,"250,000+",Art House & International,PG-13 (Some Sexuality|Martial Arts Violence),"sports and fitness, action, adventure",Chinese,Ang Lee,"Li-Kong Hsu, William Kong, Ang Lee",,"Dec 22, 2000 wide","Apr 16, 2012",$128.1M,2h,"Columbia Pictures Film Production Asia, United China Vision, Sony Pictures Classics, Good Machine, China Film Co-Production Corporation, Edko Films, Asia Union Film & Entertainment Ltd.","Dolby SR, Dolby Digital, Surround",Scope (2.35:1),,"Chow Yun-Fat, Michelle Yeoh, Zhang Ziyi, Chen Chang, Sihung Lung, Pei-pei Cheng, Li Fazeng, Xian Gao, Hai Yan, Wang Deming, Ang Lee, Hui-Ling Wang, James Schamus, Kuo Jung Tsai, Li-Kong Hsu, William Kong, Ang Lee, Phillip Lee",http://www.rottentomatoes.com/m/crouching_tiger_hidden_dragon
262,Aguirre: The Wrath of God,1972,"Don Lope de Aguirre (Klaus Kinski), a ruthless Spanish conquistador, vies for power while part of an expedition in Peru to find El Dorado, the mythical seven cities of gold. Accompanied by his daughter, Flores (Cecilia Rivera), Aguirre faces off against his superior, Don Pedro de Ursua (Ruy Guerra), and grows increasingly volatile after seizing control of the group. As Aguirre presses deeper into the Amazonian jungle, he descends further into madness.",96,91,"A haunting journey of natural wonder and tangible danger, Aguirre transcends epic genre trappings and becomes mythological by its own right.",50,"10,000+",Art House & International,,adventure,English,Werner Herzog,Werner Herzog,Werner Herzog,,"Feb 15, 2017",,1h 34m,"Werner Herzog Filmproduktion, Hessischer Rundfunk",,,,"Klaus Kinski, Ruy Guerra, Helena Rojo, Del Negro, Cecilia Rivera, Edward Roland, Werner Herzog, Werner Herzog, Werner Herzog, Thomas Mauch, Beate Mainka-Jellinghaus",http://www.rottentomatoes.com/m/aguirre_the_wrath_of_god
263,Jiro Dreams of Sushi,2011,"Revered sushi chef Jiro Ono strives for perfection in his work, while his eldest son, Yoshikazu, has trouble living up to his father's legacy.",99,91,"Beautiful, thoughtful, and engrossing, Jiro Dreams of Sushi should prove satisfying even for filmgoers who don't care for the cuisine.",95,"25,000+",Art House & International,PG (Mild Thematic Elements|Brief Smoking),documentary,Japanese,David Gelb,"Matt Weaver, Tom Pelligrini",,"Mar 9, 2012 limited","Aug 10, 2016",$2.6M,1h 21m,"Preferred Content, Sundial Pictures",,,,"Jiro Ono, David Gelb, Joey Carey, Kevin Iwashina, Stefan Nowicki, Matt Weaver, Tom Pelligrini, David Gelb",http://www.rottentomatoes.com/m/jiro_dreams_of_sushi
264,Border,2018,"Customs officer Tina is known for her extraordinary sense of smell. It's almost as if she can sniff out the guilt on anyone hiding something. But when Vore, a suspicious-looking man, walks past her, her abilities are challenged for the first time ever. Tina can sense Vore is hiding something she can't identify. Even worse, she feels a strange attraction to him. As Tina develops a special bond with Vore and discovers his true identity, she also realizes the truth about herself.",97,76,"Thrilling, unpredictable, and brilliantly acted, Border (Gräns) offers a singular treat to genre fans looking for something different.",128,"1,000+",Art House & International,R (Graphic Nudity|A Bloody Violent Image|Language|Some Sexual Content),"mystery and thriller, romance, fantasy, horror",Swedish,Ali Abbasi,"Nina Bisgaard, Peter Gustafsson, Petra Jönsson","Ali Abbasi, Isabella Eklöf, John Ajvide Lindqvist","Oct 26, 2018 limited","Feb 22, 2019",$771.9K,1h 48m,"Meta Film Stockholm, Kärnfilm, Black Spark Film & TV",Dolby Digital,Scope (2.35:1),,"Eva Melander, Eero Milonoff, Jörgen Thorsson, Andreas Kundler, Ali Abbasi, Ali Abbasi, John Ajvide Lindqvist, Peter Gustafsson, Petra Jönsson, Meta Louise Foldager, Louis Tisné, Nadim Carlsen",http://www.rottentomatoes.com/m/border_2018
265,Still Walking,2008,"Twelve years after their beloved eldest son, Junpei, drowned while saving a stranger's life, Kyohei (Yoshio Harada) and Toshiko (Kirin Kiki) welcome their surviving children home for a family reunion. Younger son Ryota (Hiroshi Abe) still feels that his parents resent that he isn't the one who died; his new wife, Yukari (Yui Natsukawa), is awkwardly meeting the rest of the family for the first time. Daughter Chinami (You) strains to fill the uncomfortable pauses with forced cheer.",100,90,"Hirokazu Kore-eda's film may seem modest at first, but this family drama casts a delicate, entrancing spell.",64,"2,500+",Art House & International,,drama,Japanese,Hirokazu Koreeda,"Yoshihiro Kato, Satoshi Kono, Hijiri Taguchi, Masahiro Yasuda",Hirokazu Koreeda,"Aug 28, 2009 limited","Jul 23, 2016",$163.5K,1h 54m,IFC Films,,,,"Hiroshi Abe, You, Yoshio Harada, Ryôga Hayashi, Haruko Kato, Kirin Kiki, Yui Natsukawa, Hotaru Nomoto, Kazuya Takahashi, Shohei Tanaka, Hirokazu Koreeda, Hirokazu Koreeda, Yoshihiro Kato, Satoshi Kono, Hijiri Taguchi, Hirokazu Koreeda",http://www.rottentomatoes.com/m/1216014-still_walking
266,All About My Mother,1999,"A Greek saying states that only women who have washed their eyes with tears can see clearly. This saying does not hold true for Manuela. The night a car ran over her son Esteban, Manuela cried until her eyes ran completely dry. Far from seeing clearly, the present and the future become mixed up in darkness. She begins looking for his father who has become a transvestite.",98,93,"Almodovar weaves together a magnificent tapestry of femininity with an affectionate wink to classics of theater and cinema in this poignant story of love, loss and compassion.",90,"50,000+",Art House & International,R (Sexuality|Language|Some Drug Content|Strong Sexual Dialogue),"comedy, drama",Spanish (Spain),Pedro Almodóvar,Agustín Almodóvar,Pedro Almodóvar,,"Feb 12, 2014",$8.3M,1h 39m,"Via Digital, El Deseo S.A.","Dolby SR, Dolby Digital, Surround",Scope (2.35:1),,"Cecilia Roth, Eloy Azorín, Marisa Paredes, Penélope Cruz, Antonia San Juan, Rosa María Sardá, Toni Canto, Pedro Almodóvar, Pedro Almodóvar, Agustín Almodóvar, Michel Ruben, Affonso Beato, José Salcedo, Antxón Gómez, Antxón Gómez",http://www.rottentomatoes.com/m/all_about_my_mother
267,Poetry,2010,At the end of her life a woman searches for new meaning.,100,86,"Poetry is an absorbing, poignant drama because it offers no easy answers to its complex central conflict.",72,"5,000+",Art House & International,,drama,Korean,Chang-dong Lee,Jun-dong Lee,Chang-dong Lee,,"Aug 10, 2016",$355.0K,2h 19m,Painhauseupilreum,,,,"Jeong-hee Yoon, Da-wit Lee, Hira Kim, Ahn Naesang, Yong-taek Kim, Chang-dong Lee, Chang-dong Lee, Jun-dong Lee, Hyun Seok Kim, Hyun Kim",http://www.rottentomatoes.com/m/poetry_2010
268,The Band's Visit,2007,"The eight Egyptian musicians who comprise the Alexandria Ceremonial Police Orchestra arrive by mistake in a small town in Israel's Negev Desert. Their booking set for a different city, and with no transportation out of the town or any hotels to stay at, the band settles at a restaurant owned by Dina (Ronit Elkabetz), who offers them lodging. Overcoming ethnic barriers, the Egyptians find diversion and companionship with the Israelis through a pervading undercurrent of shared melancholy.",98,86,"The Band's Visit is both a clever, subtle slice-of-life comedy, and poignant cross-cultural exploration.",119,"10,000+",Art House & International,PG-13 (Brief Strong Language),"comedy, drama",Arabic,Eran Kolirin,"Ehud Bleiberg, Koby Gal-Raday, Guy Jacoel, Eilon Ratzkovsky, Yossi Uzrad",Eran Kolirin,"Feb 8, 2008 limited","Jul 30, 2013",$3.1M,1h 26m,"July August Productions, Keshet Broadcasting, Tel Aviv, Bleiberg Entertainment",Dolby Digital,,,"Sasson Gabai, Ronit Elkabetz, Saleh Bakri, Khalifa Natour, Rubi Moskovitz, Uri Gavriel, Imad Jabarin, Hilla Sarjon, Eran Kolirin, Eran Kolirin, Ehud Bleiberg, Koby Gal-Raday, Guy Jacoel, Eilon Ratzkovsky, Yossi Uzrad, Shai Goldman, Arik Leibovitch",http://www.rottentomatoes.com/m/the_bands_visit
269,Waltz With Bashir,2008,"Israeli filmmaker Ari Folman wrote, directed and stars in this autobiographical animated film. As a 19-year-old infantry soldier in the 1982 war with Lebanon, Folman witnessed the Sabra and Shatila massacre, but realizes that he has no memory of the event. In 2006, he seeks out others who were in Beirut at the time to discuss their memories, including a psychologist specializing in post-traumatic stress disorders and the first journalist to cover the massacre.",96,91,"A wholly innovative, original, and vital history lesson, with pioneering animation, Waltz With Bashir delivers its message about the Middle East in a mesmerizing fashion.",153,"25,000+",Art House & International,R (Dist. Images of Atrocities|Brief Nudity|Graphic Sexual Violence|Strong Violence),"documentary, drama, animation, war, biography",Hebrew,Ari Folman,"Ari Folman, Serge Lalou, Gerhard Meixner, Roman Paul",Ari Folman,"Dec 25, 2008 limited","Apr 16, 2012",$2.3M,1h 30m,"Israel Film Fund, Télévision Suisse-Romande (TSR), Radio Télévision Belge Francophone (RTBF), Razor Film Produktion GmbH, SBS, Les Films d'Ici, Medienboard Berlin-Brandenburg, Arte France",,,,"Ron Ben-Yishai, Ronny Dayag, Ari Folman, Dror Harazi, Yehezkel Lazarov, Mickey Leon, Ari Folman, Ari Folman, Ari Folman, Serge Lalou, Gerhard Meixner, Roman Paul, David Polonsky",http://www.rottentomatoes.com/m/waltz_with_bashir
270,The Seventh Seal,1956,"When disillusioned Swedish knight Antonius Block (Max von Sydow) returns home from the Crusades to find his country in the grips of the Black Death, he challenges Death (Bengt Ekerot) to a chess match for his life. Tormented by the belief that God does not exist, Block sets off on a journey, meeting up with traveling players Jof (Nils Poppe) and his wife, Mia (Bibi Andersson), and becoming determined to evade Death long enough to commit one redemptive act while he still lives.",93,93,"Narratively bold and visually striking, The Seventh Seal brought Ingmar Bergman to the world stage -- and remains every bit as compelling today.",61,"25,000+",Art House & International,,"drama, fantasy",Swedish,Ingmar Bergman,Allan Ekelund,Ingmar Bergman,,"Aug 10, 2016",,1h 36m,Svensk Filmindustri,Mono,,,"Max von Sydow, Gunnar Björnstrand, Nils Poppe, Bibi Andersson, Bengt Ekerot, Inga Gill, Gunnel Lindblom, Bertil Anderberg, Ingmar Bergman, Ingmar Bergman, Allan Ekelund, Gunnar Fischer, P.A. Lundgren, Manne Lindholm",http://www.rottentomatoes.com/m/seventh_seal
271,Waste Land,2010,"Located just outside Rio de Janeiro, Jardim Gramacho, Brazil, is the world's largest garbage landfill. Modern artist Vik Muniz works with the so-called catadores, the men and women who pick through the refuse, to create art out of recycled materials. Muniz selects six of the garbage pickers to pose as subjects in a series of photographs mimicking famous paintings. In his desire to assist the catadores and change their lives, Muniz finds himself changed as well.",100,90,"Waste Land begins with an eco-friendly premise, but quickly transforms into an uplifting portrait of the power of art and the dignity of the human spirit.",71,"5,000+",Art House & International,PG,documentary,English,"Lucy Walker, Karen Harley, João Jardim",Angus Aynsley,,"Oct 29, 2010 limited","Nov 18, 2016",$187.7K,1h 38m,,,,,"Vik Muniz, Lucy Walker, Karen Harley, João Jardim, Fernando Meirelles, Jackie De Botton, Angus Aynsley, Moby, Pedro Kos",http://www.rottentomatoes.com/m/waste-land
272,The Taste of Others,2000,"Castella (Jean-Pierre Bacri) is a successful businessman caught behind the fast-changing times. More out of boredom than out of interest, he allows his wife Anglique (Christiane Millet) to drag him to a performance of Racine's ""Bérénice."" Much to his surprise, he is overwhelmed by the power and beauty of the lead actress, Clara (Anne Alvaro). Finally, these two polar opposites are forced together when Castella tries to learn English and his English teacher turns out to be Clara.",100,82,"The Taste of Others is a fresh, witty comedy about the attraction of opposites. The characters are well-drawn and engaging and their social interactions believable.",59,"5,000+",Art House & International,R,comedy,French (France),Agnès Jaoui,Charles Gassot,"Jean-Pierre Bacri, Agnès Jaoui",,"Feb 26, 2002",$635.3K,1h 52m,"Le Studio Canal +, Les Films A4, France 2 Cinema","Dolby Stereo, Dolby Digital, Dolby A, DTS, Dolby SR",Scope (2.35:1),,"Jean-Pierre Bacri, Anne Alvaro, Alain Chabat, Brigitte Catillon, Christiane Millet, Wladimir Yordanoff, Xavier De Guillebon, Jean-Pierre Bacri, Charles Gassot, Laurent Dailland, Hervé de Luze, Brigitte Moidon, Jackie Budin, Jacky Reynal",http://www.rottentomatoes.com/m/the_taste_of_others
273,Godzilla,1954,A fire-breathing behemoth terrorizes Japan after an atomic bomb awakens it from its centuries-old sleep.,93,89,"More than straight monster-movie fare, Gojira offers potent, sobering postwar commentary.",74,"5,000+",Art House & International,,sci fi,Japanese,Ishirô Honda,Tomoyuki Tanaka,"Ishirô Honda, Shigeru Kayama",,"Apr 20, 2014",,1h 38m,"Toho Company Ltd., Jewell Enterprises",,,Godzilla,"Takashi Shimura, Momoko Kochi, Akira Takarada, Akihiko Hirata, Sachio Sakai, Fuyuki Murakami, Ren Yamamoto, Ishirô Honda, Ishirô Honda, Shigeru Kayama, Tomoyuki Tanaka, Masao Tamai",http://www.rottentomatoes.com/m/godzilla_1956
274,Amour,2012,"Retired music teachers Georges (Jean-Louis Trintignant) and Anne (Emmanuelle Riva) have spent their lives devoted to their careers and to each other. Their relationship faces its greatest challenge when Anne suffers a debilitating stroke. Though Georges himself suffers from the aches and infirmities of old age, he bravely ignores his own discomfort to take care of his wife, and is determined to keep his promise to her that she never go back to the hospital.",93,82,"With towering performances and an unflinching script from Michael Haneke, Amour represents an honest, heartwrenching depiction of deep love and responsibility.",224,"10,000+",Art House & International,PG-13 (Brief Language|A Disturbing Act|Mature Thematic Material),drama,French (France),Michael Haneke,"Margaret Ménégoz, Stefan Arndt, Veit Heideuschka, Michael Katz",Michael Haneke,"Dec 19, 2012 limited","Jul 13, 2016",$3.7M,2h 7m,"Les Films du Losange, Westdeutscher Rundfunk, Bayerischer Rundfunk",,,,"Jean-Louis Trintignant, Emmanuelle Riva, Isabelle Huppert, Alexandre Tharaud, William Shimell, Rita Blanco, Carole Franck, Dinara Droukarova, Laurent Capelluto, Michael Haneke, Michael Haneke, Margaret Ménégoz, Stefan Arndt, Michael Katz, Margaret Ménégoz, Uwe Schott, Michael Katz, Darius Khondji",http://www.rottentomatoes.com/m/amour_2013
275,Embrace of the Serpent,2015,"In the early 1900s, a young shaman (Nilbio Torres) in the Colombian Amazon helps a sick German explorer (Jan Bijvoet) and his local guide (Miguel Dionisio Ramos) search for a rare healing plant.",96,85,"As rich visually as it is thematically, Embrace of the Serpent offers a feast of the senses for film fans seeking a dose of bracing originality.",148,"5,000+",Art House & International,,"drama, history, adventure",Spanish,Ciro Guerra,Cristina Gallego,"Ciro Guerra, Jacques Toulemonde Vidal","Feb 17, 2016 limited","Oct 6, 2016",$1.3M,2h 3m,"Buffalo Film Co., Caracol Televisión",,,,"Jan Bijvoet, Brionne Davis, Nilbio Torres, Miguel Dionisio Ramos, Luigi Sciamanna, Antonio Bolivar, Ciro Guerra, Cristina Gallego, David Gallego, Nascuy Linares, Ciro Guerra, Jacques Toulemonde Vidal",http://www.rottentomatoes.com/m/embrace_of_the_serpent
276,After the Storm,2016,A dissolute private detective (Hiroshi Abe) attempts to reconnect with his distrustful family following the death of his father.,96,80,"After the Storm crosses cultural lines to offer timeless observations about parental responsibilities, personal bonds, and the capacity for forgiveness.",138,"1,000+",Art House & International,,drama,Japanese,Hirokazu Kore-eda,,Hirokazu Kore-eda,"Mar 17, 2017 limited","Jul 11, 2017",$270.2K,1h 57m,"GAGA, Fugitive Films",Dolby Digital,,,"Hiroshi Abe, Kirin Kiki, Taiyô Yoshizawa, Hirokazu Kore-eda, Hirokazu Kore-eda, Hirokazu Kore-eda",http://www.rottentomatoes.com/m/after_the_storm_2017
277,The Vanishing,1988,"Rex (Gene Bervoets) and Saskia (Johanna Ter Steege) are enjoying a biking holiday in France when, stopping at a gas station, Saskia disappears. Confounded, Rex searches everywhere, but to no avail. Three years later, he's still obsessed with finding her, pleading his case on television, putting up posters and ruining his new relationship in the process. Eventually an unassuming chemistry teacher, Raymond (Bernard-Pierre Donnadieu), approaches Rex, intimating that he knows what happened.",98,88,"A clinical, maddening descent into the mind of a serial killer and a slowly unraveling hero, culminating with one of the scariest endings of all time.",49,"10,000+",Art House & International,,mystery and thriller,Dutch,George Sluizer,"Anne Gordon, George Sluizer",,,"Mar 25, 2017",,1h 46m,Argos Films,,,,"Bernard-Pierre Donnadieu, Gene Bervoets, Johanna Ter Steege, Gwen Eckhaus, George Sluizer, Anne Gordon, George Sluizer",http://www.rottentomatoes.com/m/the_vanishing
278,Afghan Star,2009,"Director Havana Marking dives into the booming, but still young and growing, world of pop culture in Afghanistan. Newly liberated after more than 30 years of stifling Taliban rule, the country is taken with a fervor for expression. This documentary follows four contestants, including two women, as they audition, sing and compete in a countrywide ""American Idol""-type competition called ""Pop Idol."" Marking uncovers a wonderfully vibrant community, which is also surprisingly accepting.",100,77,An enlightening and sobering documentary on Afghanistan's very own X-Factor.,62,"5,000+",Art House & International,,documentary,English,Havana Marking,,,"Jun 26, 2009 limited","Nov 18, 2016",$101.5K,1h 28m,Roast Beef Productions,,,,Havana Marking,http://www.rottentomatoes.com/m/afghan_star
279,Transit,2018,The new masterwork from the director of Phoenix and Barbara. A film by Christian Petzold.,94,62,Transit lives up to its title with a challenging drama that captures characters - and puts the audience - in a state of flux and exerts an unsettling pull.,178,100+,Art House & International,,"history, drama",German,Christian Petzold,"Florian Koerner von Gustorf, Antonin Dedet",Christian Petzold,"Mar 1, 2019 limited","Jun 27, 2019",$815.3K,1h 41m,"Neon Productions, Arte, ZDF, Schramm Film",,IMAX (Scope (2.35:1)),,"Franz Rogowski, Paula Beer, Godehard Giese, Barbara Auer, Sebastian Hülk, Maryam Zaree, Antoine Oppenheim, Christian Petzold, Christian Petzold, Florian Koerner von Gustorf, Antonin Dedet, Hans Fromm, Bettina Böhler, Stefan Will",http://www.rottentomatoes.com/m/transit_2018
280,Project Nim,2011,"In the 1970s, professor Herb Terrace and his team raise a baby chimp as a human child, as part of an experiment intended to break the language barrier between animals and people.",97,84,"Equal parts hilarious, poignant, and heartbreaking, Project Nim not only tells a compelling story masterfully, but also raises the flag on the darker side of human nature.",146,"10,000+",Art House & International,PG-13 (Drug Content|Disturbing Images|Some Strong Language|Thematic Elements),documentary,English,James Marsh,Simon Chinn,Elizabeth Hess,"Jul 8, 2011 limited","Nov 30, 2016",$410.1K,1h 39m,Red Box Films,,,,"Bern Cohen, Reagan Leonard, Anna May Marsh, Dennis Lauricella, Robert Nesi, James Marsh, Elizabeth Hess, John Battsek, Andrew Ruhemann, Jamie Laurenson, Nick Fraser, Simon Chinn, Hugo Grumbar, Michael Simmonds, Jinx Godfrey",http://www.rottentomatoes.com/m/project_nim
281,Blue,1993,"Julie (Juliette Binoche) is haunted by her grief after living through a tragic auto wreck that claimed the life of her composer husband and young daughter. Her initial reaction is to withdraw from her relationships, lock herself in her apartment and suppress her pain. But avoiding human interactions on the bustling streets of Paris proves impossible, and she eventually meets up with Olivier (Benoît Régent), an old friend who harbors a secret love for her, and who could draw her back to reality.",98,93,"Three Colors: Blue contains some of director/co-writer Krzysztof Kieslowski's most visually arresting, emotionally resonant work -- and boasts an outstanding performance from Juliette Binoche in the bargain.",46,"25,000+",Art House & International,R,drama,French (Canada),Krzysztof Kieslowski,Marin Karmitz,,,"Mar 11, 2017",$539.2K,1h 37m,"MK2 Productions, CAB Productions, Canal+, France 3 (FR 3)",Surround,,,"Juliette Binoche, Benoît Régent, Florence Pernel, Hélène Vincent, Philippe Volter, Hugues Quester, Emmanuelle Riva, Julie Delpy, Zbigniew Zamachowski, Alain Decaux, Krzysztof Kieslowski, Marin Karmitz",http://www.rottentomatoes.com/m/three_colors_blue
282,Elevator to the Gallows,1958,"Restless femme fatale Florence Carala (Jeanne Moreau) recruits her lover, Julien Tavernier (Maurice Ronet), to murder her wealthy husband, Simon (Jean Wall), in his office and make it appear like a suicide. Tavernier does the dirty deed eagerly, but becomes trapped in an elevator when he returns to remove a key piece of evidence he had accidentally left behind. Tavernier's unfortunate oversight sets into motion a dark ripple of events that bloodies the cold Paris night.",93,91,"Louis Malle's hypnotic debut is a noir with genuine soul, infusing its tale of best laid plans gone awry with wistful performances, swooning cinematography, and a sultry soundtrack.",57,"1,000+",Art House & International,,mystery and thriller,French (France),Louis Malle,Jean Thuillier,"Noël Calef, Louis Malle, Roger Nimier",,"Mar 11, 2017",$104.8K,1h 30m,Nouvelles Éditions de Films [fr],Mono,,,"Jeanne Moreau, Maurice Ronet, Jean Wall, Georges Poujouly, Yori Bertin, Lino Ventura, Elga Andersen, Micheline Bona, Félix Marten, Louis Malle, Louis Malle, Roger Nimier, Jean Thuillier, Miles Davis, Jean Mandaroux, Rino Mondellini",http://www.rottentomatoes.com/m/elevator_to_the_gallows
