,title,year,synopsis,critic_score,people_score,consensus,total_reviews,total_ratings,type,rating,genre,original_language,director,producer,writer,release_date_(theaters),release_date_(streaming),box_office_(gross_usa),runtime,production_co,sound_mix,aspect_ratio,view_the_collection,crew,link
0,Black Panther,2018,"After the death of his father, T'Challa returns home to the African nation of Wakanda to take his rightful place as king. When a powerful enemy suddenly reappears, T'Challa's mettle as king -- and as Black Panther -- gets tested when he's drawn into a conflict that puts the fate of Wakanda and the entire world at risk. Faced with treachery and danger, the young king must rally his allies and release the full power of Black Panther to defeat his foes and secure the safety of his people.",96,79,Black Panther elevates superhero cinema to thrilling new heights while telling one of the MCU's most absorbing stories -- and introducing some of its most fully realized characters.,519,"50,000+",Action & Adventure,PG-13 (Sequences of Action Violence|A Brief Rude Gesture),"adventure, action, fantasy",English,Ryan Coogler,Kevin Feige,"Ryan Coogler, Joe Robert Cole","Feb 16, 2018 wide","May 2, 2018",$700.2M,2h 14m,Walt Disney Pictures,"DTS, Dolby Atmos",Scope (2.35:1),Marvel Cinematic Universe,"Chadwick Boseman, Michael B. Jordan, Lupita Nyong'o, Danai Gurira, Martin Freeman, Daniel Kaluuya, Letitia Wright, Winston Duke, Angela Bassett, Forest Whitaker, Ryan Coogler, Ryan Coogler, Joe Robert Cole, Kevin Feige, Louis D'Esposito, Victoria Alonso, Nate Moore, Jeffrey Chernov, Stan Lee, Rachel Morrison",http://www.rottentomatoes.com/m/black_panther_2018
1,Avengers: Endgame,2019,"Adrift in space with no food or water, Tony Stark sends a message to Pepper Potts as his oxygen supply starts to dwindle. Meanwhile, the remaining Avengers -- Thor, Black Widow, Captain America and Bruce Banner -- must figure out a way to bring back their vanquished allies for an epic showdown with Thanos -- the evil demigod who decimated the planet and the universe.",94,90,"Exciting, entertaining, and emotionally impactful, Avengers: Endgame does whatever it takes to deliver a satisfying finale to Marvel's epic Infinity Saga.",538,"50,000+",Action & Adventure,PG-13 (Sequences of Sci-Fi Violence|Action|Some Language),"sci fi, adventure, action, fantasy",English,"Anthony Russo, Joe Russo",Kevin Feige,"Christopher Markus, Stephen McFeely","Apr 26, 2019 wide","Jul 30, 2019",$858.4M,3h 1m,"Marvel Studios, Walt Disney Pictures","Dolby Atmos, DTS, Dolby Digital, SDDS",Scope (2.35:1),Marvel Cinematic Universe,"Robert Downey Jr., Chris Evans, Mark Ruffalo, Chris Hemsworth, Scarlett Johansson, Jeremy Renner, Brie Larson, Paul Rudd, Don Cheadle, Karen Gillan, Anthony Russo, Joe Russo, Christopher Markus, Stephen McFeely, Kevin Feige, Louis D'Esposito, Victoria Alonso, Michael Grillo, Trinh Tran, Jon Favreau",http://www.rottentomatoes.com/m/avengers_endgame
2,Mission: Impossible -- Fallout,2018,"Ethan Hunt and the IMF team join forces with CIA assassin August Walker to prevent a disaster of epic proportions. Arms dealer John Lark and a group of terrorists known as the Apostles plan to use three plutonium cores for a simultaneous nuclear attack on the Vatican, Jerusalem and Mecca, Saudi Arabia. When the weapons go missing, Ethan and his crew find themselves in a desperate race against time to prevent them from falling into the wrong hands.",97,88,"Fast, sleek, and fun, Mission: Impossible - Fallout lives up to the ""impossible"" part of its name by setting yet another high mark for insane set pieces in a franchise full of them.",433,"10,000+",Action & Adventure,PG-13 (Intense Sequences of Action|Brief Strong Language|Violence),"action, mystery and thriller, adventure",English,Christopher McQuarrie,"Tom Cruise, Christopher McQuarrie, Jake Myers, J.J. Abrams",Christopher McQuarrie,"Jul 27, 2018 wide","Nov 20, 2018",$220.1M,2h 27m,"Bad Robot, Tom Cruise","DTS, Dolby Atmos, Dolby Digital",Scope (2.35:1),,"Tom Cruise, Henry Cavill, Ving Rhames, Simon Pegg, Rebecca Ferguson, Sean Harris, Angela Bassett, Michelle Monaghan, Alec Baldwin, Vanessa Kirby, Christopher McQuarrie, Christopher McQuarrie, Tom Cruise, Christopher McQuarrie, Jake Myers, J.J. Abrams, David Ellison, Dana Goldberg, Don Granger, Rob Hardy",http://www.rottentomatoes.com/m/mission_impossible_fallout
3,Mad Max: Fury Road,2015,"Years after the collapse of civilization, the tyrannical Immortan Joe enslaves apocalypse survivors inside the desert fortress the Citadel. When the warrior Imperator Furiosa (Charlize Theron) leads the despot's five wives in a daring escape, she forges an alliance with Max Rockatansky (Tom Hardy), a loner and former captive. Fortified in the massive, armored truck the War Rig, they try to outrun the ruthless warlord and his henchmen in a deadly high-speed chase through the Wasteland.",97,86,"With exhilarating action and a surprising amount of narrative heft, Mad Max: Fury Road brings George Miller's post-apocalyptic franchise roaring vigorously back to life.",427,"100,000+",Action & Adventure,R (Intense Sequences of Violence|Disturbing Images),"adventure, action",English,George Miller,"Doug Mitchell, George Miller, P.J. Voeten","George Miller, Brendan McCarthy, Nick Lathouris","May 15, 2015 wide","Aug 10, 2016",$153.6M,2h,"Kennedy Miller Mitchell, Village Roadshow Pictures, Warner Bros. Pictures",Dolby Atmos,Scope (2.35:1),,"Tom Hardy, Charlize Theron, Nicholas Hoult, Hugh Keays-Byrne, Josh Helman, Nathan Jones, Rosie Huntington-Whiteley, Riley Keough, Abbey Lee, George Miller, George Miller, Nick Lathouris, Doug Mitchell, George Miller, P.J. Voeten, Iain Smith, Chris deFaria",http://www.rottentomatoes.com/m/mad_max_fury_road
4,Spider-Man: Into the Spider-Verse,2018,"Bitten by a radioactive spider in the subway, Brooklyn teenager Miles Morales suddenly develops mysterious powers that transform him into the one and only Spider-Man. When he meets Peter Parker, he soon realizes that there are many others who share his special, high-flying talents. Miles must now use his newfound skills to battle the evil Kingpin, a hulking madman who can open portals to other universes and pull different versions of Spider-Man into our world.",97,93,"Spider-Man: Into the Spider-Verse matches bold storytelling with striking animation for a purely enjoyable adventure with heart, humor, and plenty of superhero action.",387,"10,000+",Action & Adventure,PG (Mild Language|Frenetic Action Violence|Thematic Elements),"action, adventure, fantasy, comedy, kids and family, animation",English,"Bob Persichetti, Peter Ramsey, Rodney Rothman","Avi Arad, Amy Pascal, Phil Lord, Christopher Miller, Christina Steinberg","Phil Lord, Rodney Rothman","Dec 14, 2018 wide","Mar 7, 2019",$190.2M,1h 57m,"Lord Miller, Sony Pictures Animation, Pascal Pictures, Avi Arad","Dolby Atmos, DTS, Dolby Digital, SDDS",Scope (2.35:1),,"Shameik Moore, Hailee Steinfeld, Mahershala Ali, Brian Tyree Henry, Lily Tomlin, Luna Lauren Velez, John Mulaney, Kimiko Glenn, Bob Persichetti, Peter Ramsey, Rodney Rothman, Phil Lord, Rodney Rothman, Avi Arad, Amy Pascal, Phil Lord, Christopher Miller, Christina Steinberg",http://www.rottentomatoes.com/m/spider_man_into_the_spider_verse
5,Wonder Woman,2017,"Before she was Wonder Woman (Gal Gadot), she was Diana, princess of the Amazons, trained to be an unconquerable warrior. Raised on a sheltered island paradise, Diana meets an American pilot (Chris Pine) who tells her about the massive conflict that's raging in the outside world. Convinced that she can stop the threat, Diana leaves her home for the first time. Fighting alongside men in a war to end all wars, she finally discovers her full powers and true destiny.",93,83,"Thrilling, earnest, and buoyed by Gal Gadot's charismatic performance, Wonder Woman succeeds in spectacular fashion.",463,"100,000+",Action & Adventure,PG-13 (Sequences of Violence|Action|Some Suggestive Content),"adventure, fantasy, action",English,Patty Jenkins,"Charles Roven, Deborah Snyder, Zack Snyder, Richard Suckle",Allan Heinberg,"Jun 2, 2017 wide","Jul 10, 2017",$412.8M,2h 21m,"Atlas Entertainment, Cruel and Unusual","SDDS, Dolby Atmos, DTS",Scope (2.35:1),DC Extended Universe,"Gal Gadot, Chris Pine, Connie Nielsen, Robin Wright, Danny Huston, David Thewlis, Ewen Bremner, Lucy Davis, Patty Jenkins, Allan Heinberg, Charles Roven, Deborah Snyder, Zack Snyder, Richard Suckle, Geoff Johns, Jon Berg, Wesley Coller, Rebecca Steel Roven",http://www.rottentomatoes.com/m/wonder_woman_2017
6,Dunkirk,2017,"In May 1940, Germany advanced into France, trapping Allied troops on the beaches of Dunkirk. Under air and ground cover from British and French forces, troops were slowly and methodically evacuated from the beach using every serviceable naval and civilian vessel that could be found. At the end of this heroic mission, 330,000 French, British, Belgian and Dutch soldiers were safely evacuated.",92,81,"Dunkirk serves up emotionally satisfying spectacle, delivered by a writer-director in full command of his craft and brought to life by a gifted ensemble cast that honors the fact-based story.",458,"50,000+",Action & Adventure,PG-13 (Some Language|Intense War Experience),"drama, history, war",English,Christopher Nolan,"Emma Thomas, Christopher Nolan",Christopher Nolan,"Jul 21, 2017 wide","Dec 12, 2017",$188.0M,1h 47m,"Warner Bros. Pictures, IMAX Corporation","Dolby Digital, Datasat, Dolby Atmos",Scope (2.35:1),,"Fionn Whitehead, Tom Glynn-Carney, Jack Lowden, Harry Styles, Aneurin Barnard, James D'Arcy, Barry Keoghan, Kenneth Branagh, Cillian Murphy, Mark Rylance, Christopher Nolan, Christopher Nolan, Emma Thomas, Christopher Nolan, Jake Myers, Nathan Crowley, Kevin Ishioka",http://www.rottentomatoes.com/m/dunkirk_2017
7,Coco,2017,"Despite his family's generations-old ban on music, young Miguel dreams of becoming an accomplished musician like his idol Ernesto de la Cruz. Desperate to prove his talent, Miguel finds himself in the stunning and colorful Land of the Dead. After meeting a charming trickster named Héctor, the two new friends embark on an extraordinary journey to unlock the real story behind Miguel's family history.",97,94,"Coco's rich visual pleasures are matched by a thoughtful narrative that takes a family-friendly -- and deeply affecting -- approach to questions of culture, family, life, and death.",347,"25,000+",Action & Adventure,PG (Thematic Elements),"comedy, music, animation, kids and family, adventure",English,Lee Unkrich,Darla K. Anderson,"Adrian Molina, Matthew Aldrich","Nov 22, 2017 wide","Feb 13, 2018",$210.5M,1h 49m,Pixar Animation Studios,Dolby Atmos,Scope (2.35:1),Pixar,"Anthony Gonzalez, Benjamin Bratt, Alanna Ubach, Jaime Camil, Alfonso Arau, Selene Luna, Ana Ofelia Murguía, Lee Unkrich, Adrian Molina, Adrian Molina, Matthew Aldrich, Darla K. Anderson, John Lasseter, Lee Unkrich, Michael Giacchino",http://www.rottentomatoes.com/m/coco_2017
8,Thor: Ragnarok,2017,"Imprisoned on the other side of the universe, the mighty Thor finds himself in a deadly gladiatorial contest that pits him against the Hulk, his former ally and fellow Avenger. Thor's quest for survival leads him in a race against time to prevent the all-powerful Hela from destroying his home world and the Asgardian civilization.",93,87,"Exciting, funny, and above all fun, Thor: Ragnarok is a colorful cosmic adventure that sets a new standard for its franchise -- and the rest of the Marvel Cinematic Universe.",430,"50,000+",Action & Adventure,PG-13 (Brief Suggestive Material|Action|Intense Sci-Fi Violence),"comedy, fantasy, sci fi, action, adventure",English,Taika Waititi,Kevin Feige,"Eric Pearson, Craig Kyle, Christopher L. Yost","Nov 3, 2017 wide","Feb 17, 2018",$315.0M,2h 10m,Marvel Studios,Dolby Atmos,Scope (2.35:1),Marvel Cinematic Universe,"Chris Hemsworth, Tom Hiddleston, Cate Blanchett, Idris Elba, Jeff Goldblum, Tessa Thompson, Mark Ruffalo, Karl Urban, Anthony Hopkins, Benedict Cumberbatch, Taika Waititi, Eric Pearson, Craig Kyle, Christopher L. Yost, Kevin Feige, Thomas M. Hammel, Stan Lee, Victoria Alonso, Louis D'Esposito",http://www.rottentomatoes.com/m/thor_ragnarok_2017
9,Logan,2017,"In the near future, a weary Logan (Hugh Jackman) cares for an ailing Professor X (Patrick Stewart) at a remote outpost on the Mexican border. His plan to hide from the outside world gets upended when he meets a young mutant (Dafne Keen) who is very much like him. Logan must now protect the girl and battle the dark forces that want to capture her.",93,90,"Hugh Jackman makes the most of his final outing as Wolverine with a gritty, nuanced performance in a violent but surprisingly thoughtful superhero action film that defies genre conventions.",418,"50,000+",Action & Adventure,R (Language Throughout|Brief Nudity|Strong Brutal Violence),"adventure, action, fantasy",English,James Mangold,"Hutch Parker, Simon Kinberg, Lauren Shuler Donner","James Mangold, Michael Green, Scott Frank","Mar 3, 2017 wide","May 16, 2017",$226.3M,2h 17m,"Marvel Entertainment, 20th Century Fox, Hutch Parker Entertainment, Donners' Company",Dolby Atmos,Scope (2.35:1),X-Men,"Hugh Jackman, Patrick Stewart, Dafne Keen, Richard E. Grant, Doris Morgado, Boyd Holbrook, Stephen Merchant, Eriq La Salle, Elise Neal, Elizabeth Rodriguez, James Mangold, James Mangold, Michael Green, Scott Frank, Hutch Parker, Simon Kinberg, Lauren Shuler Donner, Joseph M. Caracciolo Jr., Stan Lee, Josh McLaglen",http://www.rottentomatoes.com/m/logan_2017
10,Star Wars: The Last Jedi,2017,"Luke Skywalker's peaceful and solitary existence gets upended when he encounters Rey, a young woman who shows strong signs of the Force. Her desire to learn the ways of the Jedi forces Luke to make a decision that changes their lives forever. Meanwhile, Kylo Ren and General Hux lead the First Order in an all-out assault against Leia and the Resistance for supremacy of the galaxy.",90,42,Star Wars: The Last Jedi honors the saga's rich legacy while adding some surprising twists -- and delivering all the emotion-rich action fans could hope for.,476,"100,000+",Action & Adventure,PG-13 (Violence|Sequences of Sci-Fi Action),"action, sci fi, adventure, fantasy",English,Rian Johnson,"Kathleen Kennedy, Ram Bergman",Rian Johnson,"Dec 15, 2017 wide","Mar 11, 2018",$620.2M,2h 32m,Lucasfilm Ltd.,"DTS, Dolby Digital, Dolby Atmos",Scope (2.35:1),Star Wars Saga,"Mark Hamill, Carrie Fisher, Adam Driver, Daisy Ridley, John Boyega, Oscar Isaac, Andy Serkis, Lupita Nyong'o, Domhnall Gleeson, Anthony Daniels, Rian Johnson, Rian Johnson, Kathleen Kennedy, Ram Bergman, J.J. Abrams, Tom Karnowski, Jason McGatlin, Steve Yedlin, Bob Ducsay",http://www.rottentomatoes.com/m/star_wars_the_last_jedi
11,Star Wars: The Force Awakens,2015,"Thirty years after the defeat of the Galactic Empire, the galaxy faces a new threat from the evil Kylo Ren (Adam Driver) and the First Order. When a defector named Finn crash-lands on a desert planet, he meets Rey (Daisy Ridley), a tough scavenger whose droid contains a top-secret map. Together, the young duo joins forces with Han Solo (Harrison Ford) to make sure the Resistance receives the intelligence concerning the whereabouts of Luke Skywalker (Mark Hamill), the last of the Jedi Knights.",93,86,"Packed with action and populated by both familiar faces and fresh blood, The Force Awakens successfully recalls the series' former glory while injecting it with renewed energy.",440,"100,000+",Action & Adventure,PG-13 (Sci-Fi Action Violence),"action, sci fi, adventure, fantasy",English,J.J. Abrams,"Kathleen Kennedy, J.J. Abrams, Bryan Burk","Lawrence Kasdan, J.J. Abrams, Michael Arndt","Dec 18, 2015 wide","Apr 1, 2016",$123,2h 16m,"Lucasfilm Ltd., Bad Robot","Dolby Digital, Dolby Atmos",Scope (2.35:1),Star Wars Saga,"Harrison Ford, Mark Hamill, Carrie Fisher, Adam Driver, Daisy Ridley, John Boyega, Oscar Isaac, Lupita Nyong'o, Andy Serkis, Domhnall Gleeson, J.J. Abrams, Lawrence Kasdan, J.J. Abrams, Michael Arndt, Kathleen Kennedy, J.J. Abrams, Bryan Burk, Tommy Harper, Jason McGatlin, Dan Mindel",http://www.rottentomatoes.com/m/star_wars_episode_vii_the_force_awakens
12,The Adventures of Robin Hood,1938,"When King Richard the Lionheart is captured, his scheming brother Prince John (Claude Rains) plots to reach the throne, to the outrage of Sir Robin of Locksley (Errol Flynn), the bandit king of Sherwood Forest. Rounding up his band of men and eventually winning the support of the lovely Maid Marian (Olivia de Havilland), Robin accuses Prince John of treachery and, when the escaped Richard returns covertly to England, joins forces with the king to prevent Prince John from taking the crown.",100,89,"Errol Flynn thrills as the legendary title character, and the film embodies the type of imaginative family adventure tailor-made for the silver screen.",48,"25,000+",Action & Adventure,PG,"action, adventure",English,"Michael Curtiz, William Keighley",Hal B. Wallis,"Norman Reilly Raine, Seton I. Miller","Feb 11, 1938 wide","Jan 23, 2014",,1h 42m,"Warner Brothers, First National Pictures",Mono,Flat (1.37:1),,"Errol Flynn, Olivia de Havilland, Basil Rathbone, Claude Rains, Patric Knowles, Eugene Pallette, Alan Hale, Herbert Mundin, Una O'Connor, Melville Cooper, Michael Curtiz, William Keighley, Norman Reilly Raine, Seton I. Miller, Henry Blanke, Hal B. Wallis, Erich Wolfgang Korngold, Tony Gaudio, Carl Jules Weyl",http://www.rottentomatoes.com/m/1000355-adventures_of_robin_hood
13,King Kong,1933,"Actress Ann Darrow (Fay Wray) and director Carl Denham (Robert Armstrong) travel to the Indian Ocean to do location shoots for Denham's new jungle picture. Along the way, the actress meets and falls for rugged First Mate John Driscoll (Bruce Cabot). Upon arriving at a mysterious island, Ann is taken hostage by natives who prepare her as a sacrifice to the enormous ape Kong who rules over their jungle. But when Ann is rescued and Kong is captured, the real trouble begins.",98,86,King Kong explores the soul of a monster -- making audiences scream and cry throughout the film -- in large part due to Kong's breakthrough special effects.,65,"50,000+",Action & Adventure,,"adventure, fantasy",English,"Merian C. Cooper, Ernest B. Schoedsack","Merian C. Cooper, Ernest B. Schoedsack","James Ashmore Creelman, Ruth Rose",,"Nov 28, 2008",,1h 40m,RKO Radio Pictures Inc.,,,,"Fay Wray, Bruce Cabot, Robert Armstrong, Frank Reicher, Sam Hardy, Noble Johnson, James Flavin, Steve Clemento, Walter Ackerman, Merian C. Cooper, Ernest B. Schoedsack, James Ashmore Creelman, Ruth Rose, David O. Selznick, Merian C. Cooper, Ernest B. Schoedsack",http://www.rottentomatoes.com/m/1011615-king_kong
14,Spider-Man: Far From Home,2019,"Peter Parker's relaxing European vacation takes an unexpected turn when Nick Fury shows up in his hotel room to recruit him for a mission. The world is in danger as four massive elemental creatures -- each representing Earth, air, water and fire -- emerge from a hole torn in the universe. Parker soon finds himself donning the Spider-Man suit to help Fury and fellow superhero Mysterio stop the evil entities from wreaking havoc across the continent.",90,95,"A breezily unpredictable blend of teen romance and superhero action, Spider-Man: Far from Home stylishly sets the stage for the next era of the MCU.",448,"50,000+ Verified",Action & Adventure,PG-13 (Sci-Fi Action Violence|Brief Suggestive Comments|Some Language),"action, comedy, fantasy, adventure",English,Jon Watts,"Kevin Feige, Amy Pascal","Chris McKenna, Erik Sommers","Jul 2, 2019 wide","Aug 27, 2019",$390.7M,2h 9m,"Columbia Pictures, Pascal Pictures, Marvel Studios","Dolby Digital, Dolby Atmos",Scope (2.35:1),Marvel Cinematic Universe,"Tom Holland, Samuel L. Jackson, Jake Gyllenhaal, Marisa Tomei, Jon Favreau, Zendaya, Jacob Batalon, Tony Revolori, Angourie Rice, Remy Hii, Jon Watts, Chris McKenna, Erik Sommers, Kevin Feige, Amy Pascal, Louis D'Esposito, Victoria Alonso, Thomas M. Hammel, Eric Hauserman Carroll, Rachel O'Connor",http://www.rottentomatoes.com/m/spider_man_far_from_home
15,Incredibles 2,2018,"Telecommunications guru Winston Deavor enlists Elastigirl to fight crime and make the public fall in love with superheroes once again. That leaves Mr. Incredible with one of his greatest challenges ever -- staying home and taking care of three rambunctious children. As Violet, Dash and Jack-Jack offer him a new set of headaches, a cybercriminal named Screenslaver launches his dastardly plan -- hypnotizing the world through computer screens.",93,84,"Incredibles 2 reunites Pixar's family crimefighting team for a long-awaited follow-up that may not quite live up to the original, but comes close enough to earn its name.",382,"10,000+",Action & Adventure,PG (Some Brief Mild Language|Action Sequences),"comedy, animation, action, kids and family, adventure",English,Brad Bird,"John Walker, Nicole Paradis Grindle",Brad Bird,"Jun 15, 2018 wide","Oct 23, 2018",$608.6M,1h 58m,"Walt Disney Pictures, Pixar Animation Studios","DTS, Dolby Digital, Dolby Atmos",Scope (2.35:1),Pixar,"Craig T. Nelson, Holly Hunter, Sarah Vowell, Huck Milner, Samuel L. Jackson, Bob Odenkirk, Catherine Keener, Brad Bird, Bill Wise, Isabella Rossellini, Brad Bird, Brad Bird, Nicole Paradis Grindle, John Lasseter, Stephen Schaffer, Michael Giacchino",http://www.rottentomatoes.com/m/incredibles_2
16,Zootopia,2016,"From the largest elephant to the smallest shrew, the city of Zootopia is a mammal metropolis where various animals live and thrive. When Judy Hopps (Ginnifer Goodwin) becomes the first rabbit to join the police force, she quickly learns how tough it is to enforce the law. Determined to prove herself, Judy jumps at the opportunity to solve a mysterious case. Unfortunately, that means working with Nick Wilde (Jason Bateman), a wily fox who makes her job even harder.",98,92,"The brilliantly well-rounded Zootopia offers a thoughtful, inclusive message that's as rich and timely as its sumptuously state-of-the-art animation -- all while remaining fast and funny enough to keep younger viewers entertained.",293,"100,000+",Action & Adventure,PG (Rude Humor|Action|Some Thematic Elements),"kids and family, comedy, adventure, animation",English,"Byron Howard, Rich Moore",Clark Spencer,"Jared Bush, Phil Johnston","Mar 4, 2016 wide","Jun 7, 2016",,1h 48m,Walt Disney Animation Studios,Dolby Atmos,,,"Ginnifer Goodwin, Jason Bateman, Shakira, Idris Elba, J.K. Simmons, Nate Torrence, Jenny Slate, Tommy Chong, Octavia Spencer, Bonnie Hunt, Byron Howard, Rich Moore, Jared Bush, Jared Bush, Phil Johnston, Clark Spencer, John Lasseter, Fabienne Rawley, Jeremy Milton, Michael Giacchino",http://www.rottentomatoes.com/m/zootopia
17,War for the Planet of the Apes,2017,"Caesar (Andy Serkis) and his apes are forced into a deadly conflict with an army of humans led by a ruthless colonel (Woody Harrelson). After the apes suffer unimaginable losses, Caesar wrestles with his darker instincts and begins his own mythic quest to avenge his kind. As the journey finally brings them face to face, Caesar and the colonel are pitted against each other in an epic battle that will determine the fate of both of their species and the future of the planet.",94,84,"War for the Planet of the Apes combines breathtaking special effects and a powerful, poignant narrative to conclude this rebooted trilogy on a powerful -- and truly blockbuster -- note.",355,"50,000+",Action & Adventure,PG-13 (Sequences of Sci-Fi Violence|Action|Some Disturbing Images|Thematic Elements),"sci fi, adventure, action",English,Matt Reeves,"Peter Chernin, Dylan Clark, Rick Jaffa, Amanda Silver","Matt Reeves, Mark Bomback","Jul 14, 2017 wide","Apr 1, 2019",$146.8M,2h 22m,"20th Century Fox, Bluegrass Films, Chernin Entertainment",Dolby Atmos,Scope (2.35:1),Planet of the Apes,"Andy Serkis, Woody Harrelson, Steve Zahn, Karin Konoval, Terry Notary, Amiah Miller, Judy Greer, Max Lloyd-Jones, Devyn Dalton, Toby Kebbell, Matt Reeves, Matt Reeves, Mark Bomback, Peter Chernin, Dylan Clark, Rick Jaffa, Amanda Silver, Mark Bomback, Mary McLaglen, Michael Seresin",http://www.rottentomatoes.com/m/war_for_the_planet_of_the_apes
18,Spider-Man: Homecoming,2017,"Thrilled by his experience with the Avengers, young Peter Parker returns home to live with his Aunt May. Under the watchful eye of mentor Tony Stark, Parker starts to embrace his newfound identity as Spider-Man. He also tries to return to his normal daily routine -- distracted by thoughts of proving himself to be more than just a friendly neighborhood superhero. Peter must soon put his powers to the test when the evil Vulture emerges to threaten everything that he holds dear.",92,87,"Spider-Man: Homecoming does whatever a second reboot can, delivering a colorful, fun adventure that fits snugly in the sprawling MCU without getting bogged down in franchise-building.",391,"100,000+",Action & Adventure,PG-13 (Sci-Fi Action Violence|Brief Suggestive Comments|Some Language),"adventure, fantasy, action, comedy",English,Jon Watts,"Kevin Feige, Amy Pascal","Jonathan Goldstein, John Francis Daley, Jon Watts, Christopher Ford, Chris McKenna, Erik Sommers","Jul 7, 2017 wide","Jul 10, 2017",$334.4M,2h 13m,"Columbia Pictures, Marvel Studios","DTS, SDDS, Dolby Atmos",Scope (2.35:1),Marvel Cinematic Universe,"Tom Holland, Michael Keaton, Robert Downey Jr., Marisa Tomei, Jon Favreau, Gwyneth Paltrow, Zendaya, Donald Glover, Jacob Batalon, Laura Harrier, Jon Watts, Jonathan Goldstein, John Francis Daley, Jon Watts, Christopher Ford, Chris McKenna, Erik Sommers, Kevin Feige, Amy Pascal, Louis D'Esposito",http://www.rottentomatoes.com/m/spider_man_homecoming
