,title,year,synopsis,critic_score,people_score,consensus,total_reviews,total_ratings,type,rating,genre,original_language,director,producer,writer,release_date_(theaters),release_date_(streaming),box_office_(gross_usa),runtime,production_co,sound_mix,aspect_ratio,view_the_collection,crew,link
397,Mary Poppins,1964,"When Jane (Karen Dotrice) and Michael (Matthew Garber), the children of the wealthy and uptight Banks family, are faced with the prospect of a new nanny, they are pleasantly surprised by the arrival of the magical Mary Poppins (Julie Andrews). Embarking on a series of fantastical adventures with Mary and her Cockney performer friend, Bert (Dick Van Dyke), the siblings try to pass on some of their nanny's sunny attitude to their preoccupied parents (David Tomlinson, Glynis Johns).",98,86,"A lavish modern fairy tale celebrated for its amazing special effects, catchy songs, and Julie Andrews's legendary performance in the title role.",52,"250,000+",Classics,G,"kids and family, musical",English,Robert Stevenson,Walt Disney,,,"Nov 22, 2015",,2h 20m,Walt Disney Pictures,"Surround, Stereo",,,"Julie Andrews, Dick Van Dyke, Glynis Johns, David Tomlinson, Ed Wynn, Hermione Baddeley, Karen Dotrice, Matthew Garber, Arthur Treacher, Reginald Owen, Robert Stevenson, Walt Disney, Bill Walsh, Richard M. Sherman, Cotton Warburton, Edward Colman, Carroll Clark, William H. Tuntke",http://www.rottentomatoes.com/m/mary_poppins
398,Ran,1985,"At the age of seventy, after years of consolidating his empire, the Great Lord Hidetora Ichimonji (Tatsuya Nakadai) decides to abdicate and divide his domain amongst his three sons. Taro (Akira Terao), the eldest, will rule. Jiro (Jinpachi Nezu), his second son, and Saburo (Daisuke Ryu) will take command of the Second and Third Castles but are expected to obey and support their elder brother. Saburo defies the pledge of obedience and is banished.",96,95,"Akira Kurosawa's sprawling, epic take on King Lear should be required viewing for fans of westerns, war movies, or period films in general.",89,"25,000+",Classics,R,"drama, history",Japanese,Akira Kurosawa,"Masato Hara, Serge Silberman","Masato Ide, Akira Kurosawa, Hideo Oguni",,"Oct 8, 2016",$454.0K,2h 40m,"Nippon Herald Films, Greenwich Film Productions, Herald Ace","Magnetic Stereo 4 Track, Dolby Stereo, Surround",Scope (2.35:1),,"Tatsuya Nakadai, Mieko Harada, Akira Terao, Jinpachi Nezu, Daisuke Ryu, Yoshiko Miyazaki, Kazuo Kato, Masayuki Yui, Hitoshi Ueki, Hisashi Igawa, Akira Kurosawa, Masato Ide, Akira Kurosawa, Hideo Oguni, William Shakespeare, Katsumi Furukawa, Masato Hara, Hisao Kurosawa, Serge Silberman, Toru Takemitsu",http://www.rottentomatoes.com/m/ran
399,Some Like It Hot,1959,"After witnessing a Mafia murder, slick saxophone player Joe (Tony Curtis) and his long-suffering buddy, Jerry (Jack Lemmon), improvise a quick plan to escape from Chicago with their lives. Disguising themselves as women, they join an all-female jazz band and hop a train bound for sunny Florida. While Joe pretends to be a millionaire to win the band's sexy singer, Sugar (Marilyn Monroe), Jerry finds himself pursued by a real millionaire (Joe E. Brown) as things heat up and the mobsters close in.",95,94,"Some Like It Hot: A spry, quick-witted farce that never drags.",65,"50,000+",Classics,,comedy,English,Billy Wilder,Billy Wilder,"I.A.L. Diamond, Billy Wilder","Mar 1, 1959 wide","Sep 26, 2016",,2h,"United Artists, Ashton Productions, Mirisch Company",Mono,Flat (1.85:1),,"Tony Curtis, Jack Lemmon, Marilyn Monroe, George Raft, Joe E. Brown, Nehemiah Persoff, Joan Shawlee, George E. Stone, Billy Wilder, I.A.L. Diamond, Robert Thoeren, Billy Wilder, I.A.L. Diamond, Doane Harrison, Billy Wilder, Adolph Deutsch, Charles Lang",http://www.rottentomatoes.com/m/some_like_it_hot
400,It Happened One Night,1934,"In Frank Capra's acclaimed romantic comedy, spoiled heiress Ellie Andrews (Claudette Colbert) impetuously marries the scheming King Westley, leading her tycoon father (Walter Connolly) to spirit her away on his yacht. After jumping ship, Ellie falls in with cynical newspaper reporter Peter Warne (Clark Gable), who offers to help her reunite with her new husband in exchange for an exclusive story. But during their travels, the reporter finds himself falling for the feisty young heiress.",99,93,"Capturing its stars and director at their finest, It Happened One Night remains unsurpassed by the countless romantic comedies it has inspired.",96,"25,000+",Comedy,,romance,English,Frank Capra,"Frank Capra, Harry Cohn","Samuel Hopkins Adams, Robert Riskin",,"Apr 16, 2012",,1h 45m,Columbia Pictures Corporation,Mono,"35mm, Flat (1.37:1)",,"Claudette Colbert, Clark Gable, Walter Connolly, Roscoe Karns, Alan Hale, Ward Bond, Frank Capra, Frank Capra, Samuel Hopkins Adams, Robert Riskin, Frank Capra",http://www.rottentomatoes.com/m/it_happened_one_night
401,Toy Story 4,2019,"Woody, Buzz Lightyear and the rest of the gang embark on a road trip with Bonnie and a new toy named Forky. The adventurous journey turns into an unexpected reunion as Woody's slight detour leads him to his long-lost friend Bo Peep. As Woody and Bo discuss the old days, they soon start to realize that they're worlds apart when it comes to what they want from life as a toy.",97,94,"Heartwarming, funny, and beautifully animated, Toy Story 4 manages the unlikely feat of extending -- and perhaps concluding -- a practically perfect animated saga.",450,"50,000+ Verified",Comedy,G,"comedy, fantasy, animation, kids and family, adventure",English,Josh Cooley,"Mark Nielsen, Jonas Rivera, Galyn Susman","Andrew Stanton, Stephany Folsom","Jun 21, 2019 wide","Oct 1, 2019",$434.0M,1h 40m,Pixar Animation Studios,"DTS, Dolby Digital, Dolby Atmos",Scope (2.35:1),Pixar,"Tom Hanks, Tim Allen, Annie Potts, Tony Hale, Keegan-Michael Key, Madeleine McGraw, Christina Hendricks, Jordan Peele, Keanu Reeves, Ally Maki, Josh Cooley, Andrew Stanton, Stephany Folsom, Mark Nielsen, Jonas Rivera, Galyn Susman, Andrew Stanton, Lee Unkrich, Pete Docter, Patrick Lin",http://www.rottentomatoes.com/m/toy_story_4
402,Lady Bird,2017,A teenager (Saoirse Ronan) navigates a loving but turbulent relationship with her strong-willed mother (Laurie Metcalf) over the course of an eventful and poignant senior year of high school.,99,79,Lady Bird delivers fresh insights about the turmoil of adolescence -- and reveals writer-director Greta Gerwig as a fully formed filmmaking talent.,394,"10,000+",Comedy,R (Language|Brief Graphic Nudity|Sexual Content|Teen Partying),"comedy, drama",English,Greta Gerwig,"Scott Rudin, Eli Bush, Evelyn O'Neill",Greta Gerwig,"Nov 22, 2017 wide","Feb 13, 2018",$48.9M,1h 34m,"Scott Rudin Productions, A24",Dolby Digital,Flat (1.85:1),,"Saoirse Ronan, Laurie Metcalf, Timothée Chalamet, Lucas Hedges, Tracy Letts, Odeya Rush, Jake McDorman, Beanie Feldstein, Lois Smith, Stephen McKinley Henderson, Greta Gerwig, Greta Gerwig, Scott Rudin, Eli Bush, Evelyn O'Neill, Lila Yacoub, Jon Brion",http://www.rottentomatoes.com/m/lady_bird
403,BlacKkKlansman,2018,"Ron Stallworth is the first African-American detective to serve in the Colorado Springs Police Department. Determined to make a name for himself, Stallworth bravely sets out on a dangerous mission: infiltrate and expose the Ku Klux Klan. The detective soon recruits a more seasoned colleague, Flip Zimmerman, into the undercover investigation of a lifetime. Together, they team up to take down the extremist hate group as the organization aims to sanitize its rhetoric to appeal to the mainstream.",96,83,BlacKkKlansman uses history to offer bitingly trenchant commentary on current events -- and brings out some of Spike Lee's hardest-hitting work in decades along the way.,443,"10,000+",Comedy,R (Language Throughout|Disturbing/Violent Material|Racial Epithets|Some Sexual References),"comedy, drama, crime",English,Spike Lee,"Sean McKittrick, Raymond Mansfield, Jason Blum, Jordan Peele, Spike Lee","Charlie Wachtel, David Rabinowitz, Kevin Willmott, Spike Lee","Aug 10, 2018 wide","Oct 23, 2018",$48.6M,2h 14m,"40 Acres & A Mule Filmworks, QC Entertainment, Monkeypaw Productions, Blumhouse Productions",Dolby Atmos,Scope (2.35:1),,"John David Washington, Adam Driver, Laura Harrier, Topher Grace, Jasper Pääkkönen, Corey Hawkins, Ryan Eggold, Paul Walter Hauser, Ashlie Atkinson, Spike Lee, Charlie Wachtel, David Rabinowitz, Kevin Willmott, Spike Lee, Sean McKittrick, Raymond Mansfield, Jason Blum, Jordan Peele, Spike Lee",http://www.rottentomatoes.com/m/blackkklansman
404,Modern Times,1936,"This comedic masterpiece finds the iconic Little Tramp (Charlie Chaplin) employed at a state-of-the-art factory where the inescapable machinery completely overwhelms him, and where various mishaps keep getting him sent to prison. In between his various jail stints, he meets and befriends an orphan girl (Paulette Goddard). Both together and apart, they try to contend with the difficulties of modern life, with the Tramp working as a waiter and eventually a performer.",100,95,"A slapstick skewering of industrialized America, Modern Times is as politically incisive as it is laugh-out-loud hilarious.",61,"25,000+",Comedy,G,comedy,English,Charlie Chaplin,Charlie Chaplin,Charlie Chaplin,"Feb 5, 1936 wide","May 22, 2017",$163.2K,1h 29m,Charles Chaplin Productions,Mono,Flat (1.37:1),,"Charlie Chaplin, Paulette Goddard, Henry Bergman, Tiny Sandford, Chester Conklin, Hank Mann, Stanley Blystone, Cecil Reynolds, Charlie Chaplin, Charlie Chaplin, Charlie Chaplin, Charlie Chaplin, Ira H. Morgan, Jack Wilson, Carter DeHaven",http://www.rottentomatoes.com/m/modern_times
405,Eighth Grade,2018,Thirteen-year-old Kayla endures the tidal wave of contemporary suburban adolescence as she makes her way through the last week of middle school -- the end of her thus far disastrous eighth-grade year.,99,82,Eighth Grade takes a look at its titular time period that offers a rare and resounding ring of truth while heralding breakthroughs for writer-director Bo Burnham and captivating star Elsie Fisher.,313,"5,000+",Comedy,R (Some Sexual Material|Language),"comedy, drama",English,Bo Burnham,"Scott Rudin, Eli Bush, Lila Yacoub, Christopher Storer",Bo Burnham,"Aug 3, 2018 wide","Sep 25, 2018",$13.5M,1h 33m,A24,,Flat (1.85:1),,"Elsie Fisher, Daniel Zolghadri, Fred Hechinger, Luke Prael, Catherine Oliviere, Josh Hamilton, Emily Robinson, Jake Ryan, Bo Burnham, Bo Burnham, Scott Rudin, Eli Bush, Lila Yacoub, Christopher Storer, Andrew Wehde, Jennifer Lilly",http://www.rottentomatoes.com/m/eighth_grade
406,Booksmart,2019,"Academic overachievers Amy and Molly thought keeping their noses to the grindstone gave them a leg up on their high school peers. But on the eve of graduation, the best friends suddenly realize that they may have missed out on the special moments of their teenage years. Determined to make up for lost time, the girls decide to cram four years of not-to-be missed fun into one night -- a chaotic adventure that no amount of book smarts could prepare them for.",96,77,"Fast-paced, funny, and fresh, Booksmart does the seemingly impossible by adding a smart new spin to the coming-of-age comedy.",372,"2,500+ Verified",Comedy,R (Language Throughout|Drug Use and Drinking|Strong Sexual Content),"comedy, gay and lesbian",English,Olivia Wilde,"Megan Ellison, Jessica Elbaum, Katie Silberman, Chelsea Barnard, David Distenfeld","Katie Silberman, Emily Halpern, Sarah Haskins, Susanna Fogel","May 24, 2019 wide","Aug 20, 2019",$22.7M,1h 42m,Gloria Sanchez Productions,,Scope (2.35:1),,"Kaitlyn Dever, Beanie Feldstein, Jessica Williams, Jason Sudeikis, Lisa Kudrow, Will Forte, Victoria Ruesga, Mason Gooding, Skyler Gisondo, Diana Silvers, Olivia Wilde, Katie Silberman, Emily Halpern, Sarah Haskins, Susanna Fogel, Megan Ellison, Jessica Elbaum, Katie Silberman, Chelsea Barnard, David Distenfeld",http://www.rottentomatoes.com/m/booksmart
407,Coco,2017,"Despite his family's generations-old ban on music, young Miguel dreams of becoming an accomplished musician like his idol Ernesto de la Cruz. Desperate to prove his talent, Miguel finds himself in the stunning and colorful Land of the Dead. After meeting a charming trickster named Héctor, the two new friends embark on an extraordinary journey to unlock the real story behind Miguel's family history.",97,94,"Coco's rich visual pleasures are matched by a thoughtful narrative that takes a family-friendly -- and deeply affecting -- approach to questions of culture, family, life, and death.",347,"25,000+",Comedy,PG (Thematic Elements),"comedy, music, animation, kids and family, adventure",English,Lee Unkrich,Darla K. Anderson,"Adrian Molina, Matthew Aldrich","Nov 22, 2017 wide","Feb 13, 2018",$210.5M,1h 49m,Pixar Animation Studios,Dolby Atmos,Scope (2.35:1),Pixar,"Anthony Gonzalez, Benjamin Bratt, Alanna Ubach, Jaime Camil, Alfonso Arau, Selene Luna, Ana Ofelia Murguía, Lee Unkrich, Adrian Molina, Adrian Molina, Matthew Aldrich, Darla K. Anderson, John Lasseter, Lee Unkrich, Michael Giacchino",http://www.rottentomatoes.com/m/coco_2017
408,A Night at the Opera,1935,"The Marx Brothers run amuck in the world of opera when Otis B. Driftwood (Groucho Marx) meets aspiring singer Ricardo (Allan Jones), who is determined to win the love of fellow performer Rosa (Kitty Carlisle). Aided by Fiorello (Chico Marx) and Tomasso (Harpo Marx), Otis attempts to unite the young couple, but faces opposition from the preening star Lassparri (Walter Woolf King), who also has his sights on Rosa. Traveling from Italy to New York, Otis and friends rally to try and win the day.",97,91,"Watermelons may go out of season, but in A Night at the Opera, the Marx Brothers' daffy laughs are never anything less than uproariously fresh.",69,"10,000+",Comedy,,comedy,English,Sam Wood,,,,"Jan 1, 2009",,1h 33m,Metro Goldwyn Mayer,,,,"Groucho Marx, Harpo Marx, Kitty Carlisle, Chico Marx, Margaret Dumont, Allan Jones, Walter Woolf King, Sig Ruman, Sam Wood",http://www.rottentomatoes.com/m/1015002-night_at_the_opera
409,The Farewell,2019,Billi's family returns to China under the guise of a fake wedding to stealthily say goodbye to their beloved matriarch -- the only person that doesn't know she only has a few weeks to live.,97,87,"The Farewell deftly captures complicated family dynamics with a poignant, well-acted drama that marries cultural specificity with universally relatable themes.",341,"1,000+ Verified",Comedy,PG (Some Smoking|Brief Language|Thematic Material),"comedy, drama",English,Lulu Wang,"Chris Weitz, Andrew Miano, Peter Saraf, Marc Turtletaub, Anita Gou, Daniele Tate Melia, Jane Zheng, Dani Melia",Lulu Wang,"Aug 2, 2019 wide","Aug 27, 2019",$17.7M,1h 40m,"Ray Production, Kindred Spirit, Big Beach",,Scope (2.35:1),,"Awkwafina, Tzi Ma, Diana Lin, Gil Perez-Abraham, Ines Laimins, X Mayo, Lu Hong, Lulu Wang, Lulu Wang, Chris Weitz, Andrew Miano, Peter Saraf, Marc Turtletaub, Anita Gou, Jane Zheng",http://www.rottentomatoes.com/m/the_farewell_2019
410,Singin' in the Rain,1952,"A spoof of the turmoil that afflicted the movie industry in the late 1920s when movies went from silent to sound. When two silent movie stars', Don Lockwood and Lina Lamont, latest movie is made into a musical a chorus girl is brought in to dub Lina's speaking and singing. Don is on top of the world until Lina finds out.",100,95,"Clever, incisive, and funny, Singin' in the Rain is a masterpiece of the classical Hollywood musical.",64,"100,000+",Comedy,G,"comedy, musical",English,"Stanley Donen, Gene Kelly",Arthur Freed,"Betty Comden, Adolph Green","Apr 10, 1952 wide","Mar 1, 2014",$23.9K,1h 42m,Metro Goldwyn Mayer,Mono,Flat (1.37:1),,"Gene Kelly, Debbie Reynolds, Donald O'Connor, Jean Hagen, Millard Mitchell, Rita Moreno, Douglas Fowley, Cyd Charisse, Madge Blake, King Donovan, Stanley Donen, Gene Kelly, Betty Comden, Adolph Green, Arthur Freed, Nacio Herb Brown, Adrienne Fazan, Randall Duell",http://www.rottentomatoes.com/m/singin_in_the_rain
411,The Big Sick,2017,"Kumail is a Pakistani comic, who meets an American graduate student named Emily at one of his stand-up shows. As their relationship blossoms, he soon becomes worried about what his traditional Muslim parents will think of her. When Emily suddenly comes down with an illness that leaves her in a coma, Kumail finds himself developing a bond with her deeply concerned mother and father.",98,88,"Funny, heartfelt, and intelligent, The Big Sick uses its appealing leads and cross-cultural themes to prove the standard romcom formula still has some fresh angles left to explore.",302,"25,000+",Comedy,R (Some Sexual References|Language),romance,English,Michael Showalter,"Judd Apatow, Barry Mendel","Emily V. Gordon, Kumail Nanjiani","Jul 14, 2017 wide","Jul 10, 2017",$42.9M,2h,"FilmNation, Apatow Films",Dolby Digital,Flat (1.85:1),,"Kumail Nanjiani, Zoe Kazan, Holly Hunter, Ray Romano, Anupam Kher, Zenobia Shroff, Adeel Akhtar, Bo Burnham, Aidy Bryant, Kurt Braunohler, Michael Showalter, Emily V. Gordon, Kumail Nanjiani, Judd Apatow, Barry Mendel, Jeremy Kipp Walker, Kumail Nanjiani, Emily V. Gordon, Glen Basner, Ben Browning",http://www.rottentomatoes.com/m/the_big_sick
412,The Kid,1921,"Chaplin's first full-length feature is a silent masterpiece about a little tramp who discovers a little orphan and brings him up but is left desolate when the orphanage reclaims him. Chaplin directed, produced and starred in the film, as well as composed the score.",100,95,"Charles Chaplin' irascible Tramp is given able support from Jackie Coogan as The Kid in this slapstick masterpiece, balancing the guffaws with moments of disarming poignancy.",44,"10,000+",Comedy,,"comedy, drama",,Charlie Chaplin,Charlie Chaplin,Charlie Chaplin,,"Sep 2, 2016",,1h,Charles Chaplin Productions,,,,"Charlie Chaplin, Jack Coogan, Edna Purviance, Carl Miller, Granville Redmond, May White, Tom Wilson, Henry Bergman, Charles Reisner, Raymond Lee, Charlie Chaplin, Charlie Chaplin, Charlie Chaplin",http://www.rottentomatoes.com/m/1052609-kid
413,Paddington 2,2017,"Settled in with the Brown family, Paddington the bear is a popular member of the community who spreads joy and marmalade wherever he goes. One fine day, he spots a pop-up book in an antique shop -- the perfect present for his beloved aunt's 100th birthday. When a thief steals the prized book, Paddington embarks on an epic quest to unmask the culprit before Aunt Lucy's big celebration.",100,88,Paddington 2 honors its star's rich legacy with a sweet-natured sequel whose adorable visuals are matched by a story perfectly balanced between heartwarming family fare and purely enjoyable all-ages adventure.,245,"5,000+",Comedy,PG (Some Action|Mild Rude Humor),"kids and family, comedy, adventure",English (United Kingdom),Paul King,David Heyman,"Paul King, Simon Farnaby","Jan 12, 2018 wide","Mar 6, 2018",$38.4M,1h 43m,"Heyday Films, Anton Capital Entertainment",Dolby Atmos,Scope (2.35:1),,"Ben Whishaw, Hugh Grant, Sally Hawkins, Hugh Bonneville, Brendan Gleeson, Julie Walters, Jim Broadbent, Samuel Joslin, Madeleine Harris, Peter Capaldi, Simon Farnaby, David Heyman, Bob Weinstein, David C. Glasser, Ron Halpern, Didier Lupfer, Rosie Alison",http://www.rottentomatoes.com/m/paddington_2
414,Once Upon a Time... In Hollywood,2019,"Actor Rick Dalton gained fame and fortune by starring in a 1950s television Western, but is now struggling to find meaningful work in a Hollywood that he doesn't recognize anymore. He spends most of his time drinking and palling around with Cliff Booth, his easygoing best friend and longtime stunt double. Rick also happens to live next door to Roman Polanski and Sharon Tate -- the filmmaker and budding actress whose futures will forever be altered by members of the Manson Family.",85,70,"Thrillingly unrestrained yet solidly crafted, Once Upon a Time in Hollywood tempers Tarantino's provocative impulses with the clarity of a mature filmmaker's vision.",561,"25,000+ Verified",Comedy,R (Language Throughout|Drug Use|Sexual References|Some Strong Graphic Violence),"comedy, drama",English,Quentin Tarantino,"David Heyman, Shannon McIntosh, Quentin Tarantino",Quentin Tarantino,"Jul 26, 2019 wide","Aug 27, 2019",$142.4M,2h 39m,"Columbia Pictures, Bona Film Group, Heyday Films",Dolby Digital,Scope (2.35:1),,"Leonardo DiCaprio, Brad Pitt, Margot Robbie, Kurt Russell, Dakota Fanning, Damon Herriman, Austin Butler, Emile Hirsch, Scoot McNairy, Luke Perry, Quentin Tarantino, Quentin Tarantino, David Heyman, Shannon McIntosh, Quentin Tarantino, Georgia Kacandes, Yu Dong, Robert Richardson, Fred Raskin",http://www.rottentomatoes.com/m/once_upon_a_time_in_hollywood
415,Zootopia,2016,"From the largest elephant to the smallest shrew, the city of Zootopia is a mammal metropolis where various animals live and thrive. When Judy Hopps (Ginnifer Goodwin) becomes the first rabbit to join the police force, she quickly learns how tough it is to enforce the law. Determined to prove herself, Judy jumps at the opportunity to solve a mysterious case. Unfortunately, that means working with Nick Wilde (Jason Bateman), a wily fox who makes her job even harder.",98,92,"The brilliantly well-rounded Zootopia offers a thoughtful, inclusive message that's as rich and timely as its sumptuously state-of-the-art animation -- all while remaining fast and funny enough to keep younger viewers entertained.",293,"100,000+",Comedy,PG (Rude Humor|Action|Some Thematic Elements),"kids and family, comedy, adventure, animation",English,"Byron Howard, Rich Moore",Clark Spencer,"Jared Bush, Phil Johnston","Mar 4, 2016 wide","Jun 7, 2016",,1h 48m,Walt Disney Animation Studios,Dolby Atmos,,,"Ginnifer Goodwin, Jason Bateman, Shakira, Idris Elba, J.K. Simmons, Nate Torrence, Jenny Slate, Tommy Chong, Octavia Spencer, Bonnie Hunt, Byron Howard, Rich Moore, Jared Bush, Jared Bush, Phil Johnston, Clark Spencer, John Lasseter, Fabienne Rawley, Jeremy Milton, Michael Giacchino",http://www.rottentomatoes.com/m/zootopia
416,A Hard Day's Night,1964,"The Beatles in their feature film debut, one of the greatest rock-and-roll comedy adventures ever. The film has a fully restored negative and digitally restored soundtrack. The film takes on the just-left-of-reality style of mock-documentary, following ""a day in the life"" of John, Paul, George, and Ringo as fame takes them by storm.",98,89,"A Hard Day's Night, despite its age, is still a delight to watch and has proven itself to be a rock-and-roll movie classic.",109,"50,000+",Comedy,G,"comedy, musical",English,Richard Lester,Walter Shenson,Alun Owen,"Aug 11, 1964 wide","Aug 10, 2016",,1h 23m,Proscenium Films,"Stereo, Surround",Flat (1.66:1),,"The Beatles, Wilfrid Brambell, Norman Rossington, Victor Spinetti, Anna Quayle, Deryck Guyler, Eddie Malin, Robin Ray, Richard Lester, Alun Owen, Dennis O'Dell, Walter Shenson, John Lennon, Paul McCartney, Gilbert Taylor, John Jympson, Ray Simm",http://www.rottentomatoes.com/m/beatles_a_hard_days_night
417,La La Land,2016,"Sebastian (Ryan Gosling) and Mia (Emma Stone) are drawn together by their common desire to do what they love. But as success mounts they are faced with decisions that begin to fray the fragile fabric of their love affair, and the dreams they worked so hard to maintain in each other threaten to rip them apart.",90,81,"La La Land breathes new life into a bygone genre with thrillingly assured direction, powerful performances, and an irresistible excess of heart.",463,"50,000+",Comedy,PG-13 (Some Language),"comedy, drama, romance, musical",English,Damien Chazelle,"Fred Berger, Jordan Horowitz, Marc Platt, Gary Gilbert",Damien Chazelle,"Dec 25, 2016 wide","Apr 11, 2017",$151.1M,2h 8m,"Summit Entertainment, Marc Platt Productions, Gilbert Films","DTS, Dolby Digital, Dolby Atmos",Scope (2.35:1),,"Ryan Gosling, Emma Stone, John Legend, Rosemarie DeWitt, J.K. Simmons, Finn Wittrock, Meagan Fay, Callie Hernandez, Sonoya Mizuno, Jessica Rothe, Damien Chazelle, Damien Chazelle, Fred Berger, Jordan Horowitz, Marc Platt, Gary Gilbert, Linus Sandgren, Tom Cross, Justin Hurwitz, David Wasco",http://www.rottentomatoes.com/m/la_la_land
418,Top Hat,1935,"The story centers on wealthy Dale Tremont (Ginger Rogers), on holiday in London and Venice. She assumes that American entertainer Jerry Travers (Fred Astaire) is the husband of her friend Madge (Helen Broderick) -- who's actually the wife of Jerry's business manager Horace Hardwick (Edward Everett Horton).",100,91,"A glamorous and enthralling Depression-era diversion, Top Hat is nearly flawless, with acrobatics by Fred Astaire and Ginger Rogers that make the hardest physical stunts seem light as air.",42,"5,000+",Comedy,,"romance, musical",English,Mark Sandrich,Pandro S. Berman,"Károly Nóti, Allan Scott","Sep 6, 1935 wide","Aug 18, 2008",,1h 39m,RKO Radio Pictures Inc.,Mono,Flat (1.37:1),,"Fred Astaire, Ginger Rogers, Edward Everett Horton, Helen Broderick, Eric Blore, Erik Rhodes, Mark Sandrich, Aladar Laszlo, Allan Scott, Dwight Taylor, Pandro S. Berman, Irving Berlin, William Hamilton, Carroll Clark",http://www.rottentomatoes.com/m/top_hat
